{
    "componentChunkName": "component---src-pages-notes-note-slug-jsx",
    "path": "/notes/sleep-science/",
    "result": {"data":{"mdx":{"body":"var _excluded = [\"components\"];\n\nfunction _extends() { _extends = Object.assign || function (target) { for (var i = 1; i < arguments.length; i++) { var source = arguments[i]; for (var key in source) { if (Object.prototype.hasOwnProperty.call(source, key)) { target[key] = source[key]; } } } return target; }; return _extends.apply(this, arguments); }\n\nfunction _objectWithoutProperties(source, excluded) { if (source == null) return {}; var target = _objectWithoutPropertiesLoose(source, excluded); var key, i; if (Object.getOwnPropertySymbols) { var sourceSymbolKeys = Object.getOwnPropertySymbols(source); for (i = 0; i < sourceSymbolKeys.length; i++) { key = sourceSymbolKeys[i]; if (excluded.indexOf(key) >= 0) continue; if (!Object.prototype.propertyIsEnumerable.call(source, key)) continue; target[key] = source[key]; } } return target; }\n\nfunction _objectWithoutPropertiesLoose(source, excluded) { if (source == null) return {}; var target = {}; var sourceKeys = Object.keys(source); var key, i; for (i = 0; i < sourceKeys.length; i++) { key = sourceKeys[i]; if (excluded.indexOf(key) >= 0) continue; target[key] = source[key]; } return target; }\n\n/* @jsxRuntime classic */\n\n/* @jsx mdx */\nvar _frontmatter = {\n  \"title\": \"Sleep Science\",\n  \"Authors\": \"Dr. Steve Orma\",\n  \"Published\": true,\n  \"Category\": {\n    \"id\": \"QAaB\",\n    \"name\": \"Podcast\",\n    \"color\": \"default\"\n  },\n  \"Slug\": \"sleep-science\",\n  \"Source\": \"Calm\",\n  \"Date\": {\n    \"start\": \"2019-09-03T00:00:00.000Z\",\n    \"end\": null,\n    \"time_zone\": null\n  },\n  \"Type\": {\n    \"type\": \"string\",\n    \"string\": \"Note\"\n  },\n  \"URL\": \"https://www.calm.com/\"\n};\nvar layoutProps = {\n  _frontmatter: _frontmatter\n};\nvar MDXLayout = \"wrapper\";\nreturn function MDXContent(_ref) {\n  var components = _ref.components,\n      props = _objectWithoutProperties(_ref, _excluded);\n\n  return mdx(MDXLayout, _extends({}, layoutProps, props, {\n    components: components,\n    mdxType: \"MDXLayout\"\n  }), mdx(\"p\", null, \"Sleep is not hard to attain if you know what to do and what not to do. Our bodies are made to sleep. The key is to stop doing the things that are getting in the way.\"), mdx(\"h3\", null, \"Mistaken Beliefs About Sleep\"), mdx(\"p\", null, \"Sleep should be present and relaxing. It should not be something that causes anxiety or stress. To help alleviate some of the stress, these are the most common mistaken beliefs about sleep.\"), mdx(\"h4\", null, \"You Should Try to Fall Asleep\"), mdx(\"p\", null, \"The most common mistaken belief about sleep is that \", mdx(\"em\", {\n    parentName: \"p\"\n  }, \"you should try to sleep.\"), \" The harder you try to fall sleep, the longer you\\u2019ll stay awake. Sleep comes when you\\u2019re not trying. If you try to sleep, your mind monitors if you\\u2019re sleeping, which keeps your mind active and your body awake.\"), mdx(\"p\", null, \"Instead, \", mdx(\"em\", {\n    parentName: \"p\"\n  }, \"try to have the intention of relaxing and letting go\"), \". If you\\u2019re tired and ready for sleep, you\\u2019ll automatically and effortlessly fall asleep after about 10 to 20 minutes.\"), mdx(\"p\", null, \"This is why doing something calming before bed can help you fall asleep.\"), mdx(\"h4\", null, \"You Won\\u2019t Be Able to Function\"), mdx(\"p\", null, mdx(\"em\", {\n    parentName: \"p\"\n  }, \"You may believe that you won\\u2019t be able to function the next day if you don\\u2019t get a good night\\u2019s sleep.\"), \" This causes anxiety which actually prevents you from falling asleep.\"), mdx(\"p\", null, \"Research studies have shown that if you get a minimum of five and a half hours of sleep, your daytime performance will not be affected. If you get less than that, you will still be able to function, and your body will be more primed to sleep the next night.\"), mdx(\"h4\", null, \"You Need Eight Hours\"), mdx(\"p\", null, mdx(\"em\", {\n    parentName: \"p\"\n  }, \"Everyone does not need eight hours of sleep.\"), \" This isn\\u2019t a universal rule. Some people need more, and others less.\"), mdx(\"p\", null, \"Instead, focus on improving your sleep and establishing a regular pattern, and your body will tell you how many hours it needs.\"), mdx(\"h4\", null, \"You\\u2019re Just Not a Good Sleeper\"), mdx(\"p\", null, \"While it\\u2019s true that some people can fall asleep very quickly, the vast majority of people who have trouble sleeping can learn to sleep well. It\\u2019s simply a matter of learning what to do and not to do to allow your body to do what it was built for.\"), mdx(\"h3\", null, \"Sleep Behaviors\"), mdx(\"p\", null, mdx(\"strong\", {\n    parentName: \"p\"\n  }, \"Make sure your bed and bedroom act as cues for good sleep.\"), \" The goal is to create an association between lying down in your bed and falling asleep. The way to get better sleep is to practice healthy sleep behaviors that will automatically bring sleep and changing behaviors that are inhibiting sleep.\"), mdx(\"ol\", null, mdx(\"li\", {\n    parentName: \"ol\"\n  }, mdx(\"strong\", {\n    parentName: \"li\"\n  }, \"Establish a nightly bedtime routine.\"), \" Start this about an hour before going to sleep. Brushing teeth, meditating, reading, and listening to something relaxing are all good choices. Avoid electronics, work, food and serious discussion with partner. \", mdx(\"em\", {\n    parentName: \"li\"\n  }, \"Keep your routine consistent.\"), \" Do this on weekends and vacation. After a few weeks, it will become a habit and will start to associate it with sleep. You\\u2019ll start feeling tired during your routine, even before getting into bed.\"), mdx(\"li\", {\n    parentName: \"ol\"\n  }, mdx(\"strong\", {\n    parentName: \"li\"\n  }, \"Only get into bed when you are sleepy.\"), \" If you are nodding off or having a hard time staying awake, do not get into bed. This is not the same thing as being tired. Stay up even if it gets late. Worrying about sleeping will only raise your anxiety and make it harder to sleep. It\\u2019s true that you might get less sleep, but that sleep will be of better quality, and your body will feel more pressure to fall asleep.\"), mdx(\"li\", {\n    parentName: \"ol\"\n  }, mdx(\"strong\", {\n    parentName: \"li\"\n  }, \"Use your bed only for sleep and sex.\"), \" Not for work, serious relationship talks, eating, reading, watching TV, browsing the internet, talking on the phone, worrying, journaling or other activities. You want your bed to be associated with sleep. Don\\u2019t even perform these activities in the same room.\"), mdx(\"li\", {\n    parentName: \"ol\"\n  }, mdx(\"strong\", {\n    parentName: \"li\"\n  }, \"Get out of bed if you can\\u2019t fall asleep.\"), \" If you aren\\u2019t asleep after twenty to thirty minutes, then get out of bed and go into another room. Approximate this rather than keeping an eye on the clock. Getting up will tire you out quicker and will help break the association of being awake with your bed. Think of this time as \", mdx(\"em\", {\n    parentName: \"li\"\n  }, \"bonus free time\"), \". Enjoy the quiet and peace.\"), mdx(\"li\", {\n    parentName: \"ol\"\n  }, mdx(\"strong\", {\n    parentName: \"li\"\n  }, \"Once out of bed, do something boring or relaxing.\"), \" Read a dull book. Keep the lights dim. Avoid physical activity. \", mdx(\"em\", {\n    parentName: \"li\"\n  }, \"Be sure not to drift off on the couch.\"), \" Frame this period of time as \\u201Cextra free time.\\u201D\"), mdx(\"li\", {\n    parentName: \"ol\"\n  }, mdx(\"strong\", {\n    parentName: \"li\"\n  }, \"Get back into bed when you are sleepy.\"), \" Only return to bed when you are sleepy or nodding off. If you don\\u2019t fall asleep again, get back out of bed. Repeat steps 4\\u20136 as many time as needed.\"), mdx(\"li\", {\n    parentName: \"ol\"\n  }, mdx(\"strong\", {\n    parentName: \"li\"\n  }, \"Establish a regular wake up time.\"), \" This is really important to establishing a good sleep pattern. Set your alarm to wake you up at a regular time every day. Do this on weekends too. Get up even if you slept poorly. Do not use the snooze button. Get up immediately. You are trying to establish a regular, automatic sleep/wake cycle. This can be challenging, but if you do this over a few weeks, your body will start to wake up automatically around your set wakeup time.\"), mdx(\"li\", {\n    parentName: \"ol\"\n  }, mdx(\"strong\", {\n    parentName: \"li\"\n  }, \"Don\\u2019t nap during the day.\"), \" Some disagree with this, but Steve is in the no nap camp. He\\u2019d rather have you tired at night. He believes the designer to nap will go away with time. If you do nap, make sure it\\u2019s less than 45 minutes and it\\u2019s before 4 PM.\")), mdx(\"h3\", null, \"Calming Your Mind\"), mdx(\"p\", null, \"Many people have trouble falling asleep because their mind is too active. Here are some tips.\"), mdx(\"ul\", null, mdx(\"li\", {\n    parentName: \"ul\"\n  }, \"When you do get into bed, put on a sleep story. This will distract your mind and allow you to fall asleep without intruding thoughts.\"), mdx(\"li\", {\n    parentName: \"ul\"\n  }, \"If you get out of bed, grab a pad and pen and write down all of the things that are bothering you. Don\\u2019t stop until it\\u2019s all down on paper. Then tell yourself you\\u2019ll deal with it tomorrow and put the pad aside. You can wait to make decisions or take actions until the next day. Sometimes, your concerns won\\u2019t seem that important, and you can simply discard them.\\nStress isn\\u2019t necessarily bad. Exercise and positive events can be stressful in a good way. However, to fall asleep you have to be able to let go of stress so you can relax.\")), mdx(\"h3\", null, \"Destressing\"), mdx(\"p\", null, \"When you wind down, you can do anything that allows you to destress will be impactful.\"), mdx(\"ul\", null, mdx(\"li\", {\n    parentName: \"ul\"\n  }, mdx(\"strong\", {\n    parentName: \"li\"\n  }, \"Don\\u2019t skip meals.\"), \" If you don\\u2019t eat enough, you won\\u2019t have enough energy during the day, and this will increase your stress and reduce your ability to fall asleep.\"), mdx(\"li\", {\n    parentName: \"ul\"\n  }, mdx(\"strong\", {\n    parentName: \"li\"\n  }, \"If you\\u2019re sick, don\\u2019t work through it.\"), \" Taking the time to rest will help you recover much faster.\"), mdx(\"li\", {\n    parentName: \"ul\"\n  }, mdx(\"strong\", {\n    parentName: \"li\"\n  }, \"Take vacations.\"), \" You need time away from work. Try to take a week or more to recover from stress. Nights and weekends aren\\u2019t enough to manage stress and fatigue by itself.\"), mdx(\"li\", {\n    parentName: \"ul\"\n  }, mdx(\"strong\", {\n    parentName: \"li\"\n  }, \"Engage in a hobby.\"), \" Leisure activities can help you destress and add enjoyment with your life.\"), mdx(\"li\", {\n    parentName: \"ul\"\n  }, mdx(\"strong\", {\n    parentName: \"li\"\n  }, \"Socialize.\"), \" This can be fun and relaxing, and includes spending time with your partner, friends you like, and family that doesn\\u2019t stress you out.\"), mdx(\"li\", {\n    parentName: \"ul\"\n  }, mdx(\"strong\", {\n    parentName: \"li\"\n  }, \"Get a massage or have a spa day.\"), \" This can be expensive, but this can be very impactful.\")), mdx(\"h3\", null, \"Environment\"), mdx(\"ul\", null, mdx(\"li\", {\n    parentName: \"ul\"\n  }, mdx(\"strong\", {\n    parentName: \"li\"\n  }, \"Keep your bedroom cool and your bed warm.\"), \" Ideally, you\\u2019ll keep the room about 65\\xB0F is the optimal temperature for sleep. Your clothing should keep you warm, but not enough that you perspire.\"), mdx(\"li\", {\n    parentName: \"ul\"\n  }, mdx(\"strong\", {\n    parentName: \"li\"\n  }, \"Keep the room dark.\"), \" You should use blackout shades or a sleep mask. Use a night light in the bathroom. Cover your alarm clock if it emits light.\"), mdx(\"li\", {\n    parentName: \"ul\"\n  }, mdx(\"strong\", {\n    parentName: \"li\"\n  }, \"Keep the bedroom quiet.\"), \" Noise disturbs sleep. The noise that bothers us most is varying or intrusive. You may not remember in the morning when it happened. Warning earplugs, using a noise machine, or using a fan are all effective strategies for creating white noise, which masks other sounds.\"), mdx(\"li\", {\n    parentName: \"ul\"\n  }, mdx(\"strong\", {\n    parentName: \"li\"\n  }, \"Use a separate sheet or blanket.\"), \" This is especially helpful if your partner has a different body temperature.\"), mdx(\"li\", {\n    parentName: \"ul\"\n  }, mdx(\"strong\", {\n    parentName: \"li\"\n  }, \"Make your bed comfortable.\"), \" This will help you look forward to sleep. Change the type of bed, pillow and comforter to make it as comfortable as possible.\"), mdx(\"li\", {\n    parentName: \"ul\"\n  }, mdx(\"strong\", {\n    parentName: \"li\"\n  }, \"Make your bedroom inviting for sleep.\"), \" The more peaceful your bedroom feels, the more likely you\\u2019ll look forward to sleep. Use a warm or calming paint color. Use calming colors. Keep electronics out.\")), mdx(\"h3\", null, \"Exercise\"), mdx(\"p\", null, \"One of the best things you can do for yourself is to exercise. While there are many health benefits, in particular exercise can help you sleep.\"), mdx(\"ul\", null, mdx(\"li\", {\n    parentName: \"ul\"\n  }, \"It raises your body temperature, which causes a more intense drop after exercise, which helps you fall asleep. Don\\u2019t exercise more than three hours before bed.\"), mdx(\"li\", {\n    parentName: \"ul\"\n  }, \"It also places stress on your body. This tires you out, and your brain and body compensates from this is by making you sleep better.\"), mdx(\"li\", {\n    parentName: \"ul\"\n  }, \"It reduces overall stress. Your bodily stress will decrease after exercise. This also helps decrease anxiety.\\nIf you\\u2019re unable to exercise, a hot bath can have some of the physiological benefits. Don\\u2019t do this any closer than two hours before bedtime.\")), mdx(\"h3\", null, \"Light\"), mdx(\"p\", null, \"Light and darkness directly affect your circadian rhythms. When it\\u2019s light out, melatonin levels decrease and promote wakefulness. When it\\u2019s dark, melatonin increases and promotes sleep.\"), mdx(\"ul\", null, mdx(\"li\", {\n    parentName: \"ul\"\n  }, \"Get outside when it\\u2019s light.\"), mdx(\"li\", {\n    parentName: \"ul\"\n  }, \"When you first wake up in the morning, open the blinds.\"), mdx(\"li\", {\n    parentName: \"ul\"\n  }, \"Go for a morning walk.\"), mdx(\"li\", {\n    parentName: \"ul\"\n  }, \"Sit by a window that lets in light during the day.\"), mdx(\"li\", {\n    parentName: \"ul\"\n  }, \"Dim or shut off the lights after sunset.\"), mdx(\"li\", {\n    parentName: \"ul\"\n  }, \"Don\\u2019t use electronics an hour before bedtime.\"), mdx(\"li\", {\n    parentName: \"ul\"\n  }, \"Sleep in a pitch dark room.\"), mdx(\"li\", {\n    parentName: \"ul\"\n  }, \"Don\\u2019t wear sunglasses. You don\\u2019t need them. They decrease the effects of sunlight on the body\\u2019s natural sleep system. It takes a few week to adjust to not wearing them.\"), mdx(\"li\", {\n    parentName: \"ul\"\n  }, \"A light therapy device can be a good alternative to sunlight in northern climates, but it\\u2019s not as effective as a sunlight.\")));\n}\n;\nMDXContent.isMDXComponent = true;"},"note":{"authors":["Dr. Steve Orma"],"category":"Podcast","date":"2019-09-03","published":true,"slug":"sleep-science","source":"Calm","title":"Sleep Science","url":"https://www.calm.com/"}},"pageContext":{"id":"ca2eade7-f13a-5b17-a059-f03f2af3d814","slug":"sleep-science","__params":{"slug":"sleep-science"}}},
    "staticQueryHashes": []}