{
    "componentChunkName": "component---src-pages-notes-note-slug-jsx",
    "path": "/notes/ignite-the-fire-management-that-sparks-new-leaders/",
    "result": {"data":{"mdx":{"body":"var _excluded = [\"components\"];\n\nfunction _extends() { _extends = Object.assign || function (target) { for (var i = 1; i < arguments.length; i++) { var source = arguments[i]; for (var key in source) { if (Object.prototype.hasOwnProperty.call(source, key)) { target[key] = source[key]; } } } return target; }; return _extends.apply(this, arguments); }\n\nfunction _objectWithoutProperties(source, excluded) { if (source == null) return {}; var target = _objectWithoutPropertiesLoose(source, excluded); var key, i; if (Object.getOwnPropertySymbols) { var sourceSymbolKeys = Object.getOwnPropertySymbols(source); for (i = 0; i < sourceSymbolKeys.length; i++) { key = sourceSymbolKeys[i]; if (excluded.indexOf(key) >= 0) continue; if (!Object.prototype.propertyIsEnumerable.call(source, key)) continue; target[key] = source[key]; } } return target; }\n\nfunction _objectWithoutPropertiesLoose(source, excluded) { if (source == null) return {}; var target = {}; var sourceKeys = Object.keys(source); var key, i; for (i = 0; i < sourceKeys.length; i++) { key = sourceKeys[i]; if (excluded.indexOf(key) >= 0) continue; target[key] = source[key]; } return target; }\n\n/* @jsxRuntime classic */\n\n/* @jsx mdx */\nvar _frontmatter = {\n  \"title\": \"Ignite the Fire: Management That Sparks New Leaders\",\n  \"Authors\": \"Nick Caldwell\",\n  \"Published\": true,\n  \"Category\": {\n    \"id\": \"}L@k\",\n    \"name\": \"Live Talk\",\n    \"color\": \"default\"\n  },\n  \"Slug\": \"ignite-the-fire-management-that-sparks-new-leaders\",\n  \"Source\": \"DeveloperWeek 2019\",\n  \"Date\": {\n    \"start\": \"2019-02-21T00:00:00.000Z\",\n    \"end\": null,\n    \"time_zone\": null\n  },\n  \"Type\": {\n    \"type\": \"string\",\n    \"string\": \"Note\"\n  },\n  \"URL\": \"https://www.developerweek.com\"\n};\nvar layoutProps = {\n  _frontmatter: _frontmatter\n};\nvar MDXLayout = \"wrapper\";\nreturn function MDXContent(_ref) {\n  var components = _ref.components,\n      props = _objectWithoutProperties(_ref, _excluded);\n\n  return mdx(MDXLayout, _extends({}, layoutProps, props, {\n    components: components,\n    mdxType: \"MDXLayout\"\n  }), mdx(\"p\", null, \"How do you develop leaders?\"), mdx(\"p\", null, \"As you scale, you get more specialization and focus. However, you asl get politics and boundaries, and less of a sense of ownership for anyone on the team.\"), mdx(\"p\", null, mdx(\"strong\", {\n    parentName: \"p\"\n  }, \"Leadership is not management.\"), \" Management is really about predicability. If you're a good manager, a large part of your job is producing predictable output. Fundamentally, leadership is about change. You bring in a leader if you want something different to happen.\"), mdx(\"p\", null, \"Leaders lead through influence and vision, not hierarchy.\"), mdx(\"p\", null, \"Positional leadership doesn't scale. You want many people on the team not be leaders, not just the managers.\"), mdx(\"blockquote\", null, mdx(\"p\", {\n    parentName: \"blockquote\"\n  }, \"To scale leadership, we must get our employees to look for opportunities instead of positions.\")), mdx(\"blockquote\", null, mdx(\"p\", {\n    parentName: \"blockquote\"\n  }, \"Whenever you draw an org chart, the smart people are at the bottom in my experience.\")), mdx(\"p\", null, \"One of the keys is rewarding the behavior for people participating in leadership.\"), mdx(\"h3\", null, \"Anyone can be a leader\"), mdx(\"p\", null, \"Many of today's top leaders don't actually meet the common criteria of what makes a god leader.\"), mdx(\"p\", null, \"Instead of traits, look for passion.\"), mdx(\"p\", null, \"Use a tool called blue flame one-on-ones. The idea is you have perfect alignment between the needs of the organization and passion of the individual.\"), mdx(\"p\", null, \"One additional tool you can do is ask your team members what they think you're good at.l\"), mdx(\"h3\", null, \"Create Leadership Moments\"), mdx(\"blockquote\", null, mdx(\"p\", {\n    parentName: \"blockquote\"\n  }, \"The first rule of leadership is everything is your fault.\")), mdx(\"p\", null, \"Every leader has a moment in their career where they decide to step up and lead.\"), mdx(\"blockquote\", null, mdx(\"p\", {\n    parentName: \"blockquote\"\n  }, \"Leaders take responsibility for what happens next.\")), mdx(\"p\", null, \"We need to create a culture that eliminates fear of stepping up.\"), mdx(\"p\", null, \"One tool you can use to help leaders step up is to sponsor individuals. \", mdx(\"em\", {\n    parentName: \"p\"\n  }, \"Push the idea like it was your own, but give away the credit.\"), \" If you give away the credit, you'll encourage others to step up.\"), mdx(\"p\", null, \"To make a leader, you need opportunity, passion and permissions.\"), mdx(\"blockquote\", null, mdx(\"p\", {\n    parentName: \"blockquote\"\n  }, \"Leaders make new leaders.\")));\n}\n;\nMDXContent.isMDXComponent = true;"},"note":{"authors":["Nick Caldwell"],"category":"Live Talk","date":"2019-02-21","published":true,"slug":"ignite-the-fire-management-that-sparks-new-leaders","source":"DeveloperWeek 2019","title":"Ignite the Fire: Management That Sparks New Leaders","url":"https://www.developerweek.com"}},"pageContext":{"id":"292679b8-d2aa-5eab-9c71-88d82dd28e83","slug":"ignite-the-fire-management-that-sparks-new-leaders","__params":{"slug":"ignite-the-fire-management-that-sparks-new-leaders"}}},
    "staticQueryHashes": []}