{
    "componentChunkName": "component---src-pages-notes-note-slug-jsx",
    "path": "/notes/everything-you-need-to-know-machine-learning/",
    "result": {"data":{"mdx":{"body":"var _excluded = [\"components\"];\n\nfunction _extends() { _extends = Object.assign || function (target) { for (var i = 1; i < arguments.length; i++) { var source = arguments[i]; for (var key in source) { if (Object.prototype.hasOwnProperty.call(source, key)) { target[key] = source[key]; } } } return target; }; return _extends.apply(this, arguments); }\n\nfunction _objectWithoutProperties(source, excluded) { if (source == null) return {}; var target = _objectWithoutPropertiesLoose(source, excluded); var key, i; if (Object.getOwnPropertySymbols) { var sourceSymbolKeys = Object.getOwnPropertySymbols(source); for (i = 0; i < sourceSymbolKeys.length; i++) { key = sourceSymbolKeys[i]; if (excluded.indexOf(key) >= 0) continue; if (!Object.prototype.propertyIsEnumerable.call(source, key)) continue; target[key] = source[key]; } } return target; }\n\nfunction _objectWithoutPropertiesLoose(source, excluded) { if (source == null) return {}; var target = {}; var sourceKeys = Object.keys(source); var key, i; for (i = 0; i < sourceKeys.length; i++) { key = sourceKeys[i]; if (excluded.indexOf(key) >= 0) continue; target[key] = source[key]; } return target; }\n\n/* @jsxRuntime classic */\n\n/* @jsx mdx */\nvar _frontmatter = {\n  \"title\": \"Everything You Need to Know to Start Your First Machine Learning Project\",\n  \"Authors\": \"Kirsten Westeinde\",\n  \"Published\": true,\n  \"Media\": {\n    \"id\": \"}L@k\",\n    \"name\": \"Live Talk\",\n    \"color\": \"default\"\n  },\n  \"Slug\": \"everything-you-need-to-know-machine-learning\",\n  \"Source\": \"DeveloperWeek 2019\",\n  \"Date\": {\n    \"start\": \"2019-02-20T00:00:00.000Z\",\n    \"end\": null,\n    \"time_zone\": null\n  },\n  \"Category\": {\n    \"id\": \"7c590fdc-8922-4760-8d45-5b3cf6f6b991\",\n    \"name\": \"Development\",\n    \"color\": \"default\"\n  },\n  \"Type\": {\n    \"type\": \"string\",\n    \"string\": \"Note\"\n  },\n  \"URL\": \"https://www.developerweek.com\"\n};\nvar layoutProps = {\n  _frontmatter: _frontmatter\n};\nvar MDXLayout = \"wrapper\";\nreturn function MDXContent(_ref) {\n  var components = _ref.components,\n      props = _objectWithoutProperties(_ref, _excluded);\n\n  return mdx(MDXLayout, _extends({}, layoutProps, props, {\n    components: components,\n    mdxType: \"MDXLayout\"\n  }), mdx(\"h3\", null, \"1. Identify the Problem You Want to Solve\"), mdx(\"p\", null, \"Types of machine learning problems:\"), mdx(\"ul\", null, mdx(\"li\", {\n    parentName: \"ul\"\n  }, mdx(\"strong\", {\n    parentName: \"li\"\n  }, \"Supervised:\"), \" You can use past data to derive answers to future problems.\"), mdx(\"li\", {\n    parentName: \"ul\"\n  }, mdx(\"strong\", {\n    parentName: \"li\"\n  }, \"Unsupervised:\"), \" The data set doesn't have any answers and the object is to find some structure.\")), mdx(\"p\", null, \"You usually start with an unsupervised model to identify the structure, and then use supervised as the product.\"), mdx(\"p\", null, \"There are two types of supervised problems:\"), mdx(\"ul\", null, mdx(\"li\", {\n    parentName: \"ul\"\n  }, mdx(\"strong\", {\n    parentName: \"li\"\n  }, \"Classification:\"), \" The answer is a discreet value.\"), mdx(\"li\", {\n    parentName: \"ul\"\n  }, mdx(\"strong\", {\n    parentName: \"li\"\n  }, \"Regression:\"), \" The answer can be any continuous value.\")), mdx(\"p\", null, \"If you can frame your problem as a classification or regression problem, then it's a good candidate for machine learning.\"), mdx(\"p\", null, \"Machine learning is resource expensive, so if there's a simple heuristic system that's \\\"good enough,\\\" then use that.\"), mdx(\"h3\", null, \"2. Frame the Problem as a Machine Learning Model\"), mdx(\"p\", null, \"It's really helpful to include a problem domain expert on the team.\"), mdx(\"ul\", null, mdx(\"li\", {\n    parentName: \"ul\"\n  }, mdx(\"strong\", {\n    parentName: \"li\"\n  }, \"Prediction target:\"), \" The thing your model is trying to predict. Everyone needs to agree on this. This can be harder to determine than it seems. You should codify and unit test this.\"), mdx(\"li\", {\n    parentName: \"ul\"\n  }, mdx(\"strong\", {\n    parentName: \"li\"\n  }, \"Labeled data:\"), \" You need a data set where you know the answers.\"), mdx(\"li\", {\n    parentName: \"ul\"\n  }, mdx(\"strong\", {\n    parentName: \"li\"\n  }, \"Data preprocessing:\"), \" Transform the data to a format that works for your model. As an example, you can use \", mdx(\"em\", {\n    parentName: \"li\"\n  }, \"normalization\"), \" to get all of your data into the same range. This is important when weighing parameters.\"), mdx(\"li\", {\n    parentName: \"ul\"\n  }, mdx(\"strong\", {\n    parentName: \"li\"\n  }, \"Features:\"), \" The parameters you want to include in your algorithm.\"), mdx(\"li\", {\n    parentName: \"ul\"\n  }, mdx(\"strong\", {\n    parentName: \"li\"\n  }, \"Acceptance criteria:\"), \" You need to know: \\\"when will my model be good enough?\\\" This is usually in terms of accuracy.\")), mdx(\"p\", null, \"You also want to include data points from a wide variety of situations so you don't introduce bias in your model.  You also need to be careful that you don't encode biases that are already in the system. You can algorithmically generate data from a smaller data set in some cases (such as applying distortion to text input.)\"), mdx(\"p\", null, \"When choosing features, mix your own intuition with statistical analysis.\"), mdx(\"blockquote\", null, mdx(\"p\", {\n    parentName: \"blockquote\"\n  }, \"Could a human expert confidently predict the outcome given these pieces of information?\")), mdx(\"p\", null, \"You need to evaluate the quality of the data for long-term consistency. This is an ongoing process.\"), mdx(\"h3\", null, \"3. Train the Model\"), mdx(\"p\", null, \"Many times libraries will do this for you. The process is also usually well-documented.\"), mdx(\"h3\", null, \"4. Productizing the Model\"), mdx(\"p\", null, \"PMML is a standardized language for expressing a machine learning model and its results. Most languages have packages that can interpret it.\"), mdx(\"p\", null, \"After training your model, you need to verify its accurate. The first step is to figure out the accuracy of your model in comparison to a test set of data.\"), mdx(\"p\", null, \"You can also release your model in \\\"shadow mode,\\\" where it's making predictions but isn't actually sharing those with the user. You need to do this every time you do an update to your model.\"), mdx(\"p\", null, \"You'll also want to have alerts set up for your algorithm's accuracy. And automate the pipeline as much as possible.\"), mdx(\"p\", null, \"More likely than not, your first model will be bad. You have to be willing to see it as a process and be willing to iterate.\"), mdx(\"p\", null, \"In the future, Tensorflow allows you to deploy a model to GKE and then make predictions in real time. If you're just starting out, Tensorflow has a low barrier to entry.\"));\n}\n;\nMDXContent.isMDXComponent = true;"},"note":{"authors":["Kirsten Westeinde"],"category":"Development","media":"Live Talk","date":"2019-02-20","published":true,"slug":"everything-you-need-to-know-machine-learning","source":"DeveloperWeek 2019","title":"Everything You Need to Know to Start Your First Machine Learning Project","url":"https://www.developerweek.com"}},"pageContext":{"id":"c01d30f8-041d-5664-ad55-0852cccc01e4","slug":"everything-you-need-to-know-machine-learning","__params":{"slug":"everything-you-need-to-know-machine-learning"}}},
    "staticQueryHashes": []}