{
    "componentChunkName": "component---src-pages-notes-note-slug-jsx",
    "path": "/notes/jobs-to-be-done/",
    "result": {"data":{"mdx":{"body":"var _excluded = [\"components\"];\n\nfunction _extends() { _extends = Object.assign || function (target) { for (var i = 1; i < arguments.length; i++) { var source = arguments[i]; for (var key in source) { if (Object.prototype.hasOwnProperty.call(source, key)) { target[key] = source[key]; } } } return target; }; return _extends.apply(this, arguments); }\n\nfunction _objectWithoutProperties(source, excluded) { if (source == null) return {}; var target = _objectWithoutPropertiesLoose(source, excluded); var key, i; if (Object.getOwnPropertySymbols) { var sourceSymbolKeys = Object.getOwnPropertySymbols(source); for (i = 0; i < sourceSymbolKeys.length; i++) { key = sourceSymbolKeys[i]; if (excluded.indexOf(key) >= 0) continue; if (!Object.prototype.propertyIsEnumerable.call(source, key)) continue; target[key] = source[key]; } } return target; }\n\nfunction _objectWithoutPropertiesLoose(source, excluded) { if (source == null) return {}; var target = {}; var sourceKeys = Object.keys(source); var key, i; for (i = 0; i < sourceKeys.length; i++) { key = sourceKeys[i]; if (excluded.indexOf(key) >= 0) continue; target[key] = source[key]; } return target; }\n\n/* @jsxRuntime classic */\n\n/* @jsx mdx */\nvar _frontmatter = {\n  \"title\": \"Jobs to Be Done\",\n  \"Authors\": \"Stephen Wunker, Jessica Wattman, David Farber\",\n  \"Published\": true,\n  \"Category\": {\n    \"id\": \"650097b4-ead7-4703-a1dd-15e1ee9c8d02\",\n    \"name\": \"Book\",\n    \"color\": \"default\"\n  },\n  \"Slug\": \"jobs-to-be-done\",\n  \"Source\": \"Jobs to be Done\",\n  \"Date\": {\n    \"start\": \"2017-07-30T00:00:00.000Z\",\n    \"end\": null,\n    \"time_zone\": null\n  },\n  \"Type\": {\n    \"type\": \"string\",\n    \"string\": \"Note\"\n  },\n  \"URL\": \"https://smile.amazon.com/Jobs-Be-Done-Customer-Centered-Innovation/dp/0814438032?sa-no-redirect=1\"\n};\nvar layoutProps = {\n  _frontmatter: _frontmatter\n};\nvar MDXLayout = \"wrapper\";\nreturn function MDXContent(_ref) {\n  var components = _ref.components,\n      props = _objectWithoutProperties(_ref, _excluded);\n\n  return mdx(MDXLayout, _extends({}, layoutProps, props, {\n    components: components,\n    mdxType: \"MDXLayout\"\n  }), mdx(\"blockquote\", null, mdx(\"p\", {\n    parentName: \"blockquote\"\n  }, \"The core premise is the intuitive but not so obvious idea that by digging into the \\\"why\\\" of people's actions, you can uncover a set of reasons\\u2014emotional, psychological, and practical\\u2014that drive people to behave in certain ways rather than others.\\nUltimately, people are just trying to get things done in their lives, whether they are making a purchase for their own use, collaborating in a business-to-business transaction, or consuming a government service.\\nOnce you understand what jobs people are striving to do, it becomes easier to predict which products or services will take off and which will fall flat.\")), mdx(\"h3\", null, \"Jobs\"), mdx(\"p\", null, \"Jobs are the underlying tasks that customers are trying to get done. They are customer demands that are specific to discrete customer types and occasions.\"), mdx(\"p\", null, \"The focus is on the fundamental task, not what the customer says they want or need, or their measurable outcomes.\"), mdx(\"p\", null, \"We're looking for jobs that are important and unsatisfied \", mdx(\"em\", {\n    parentName: \"p\"\n  }, \"in the eyes of the customer\"), \".\"), mdx(\"blockquote\", null, mdx(\"p\", {\n    parentName: \"blockquote\"\n  }, \"People don't want to buy a quarter-inch drill. They want a quarter-inch hole.\\nJobs let us focus or energy and resources where they'll make the biggest impact.\")), mdx(\"h3\", null, \"Job Drivers\"), mdx(\"p\", null, \"Job drivers are the underlying contextual elements that make certain jobs more or less important for specific customers.\"), mdx(\"ul\", null, mdx(\"li\", {\n    parentName: \"ul\"\n  }, \"Attitudes: personality traits that affect behavior and decision-making.\"), mdx(\"li\", {\n    parentName: \"ul\"\n  }, \"Background: Long-term context that affects behavior and decision-making.\"), mdx(\"li\", {\n    parentName: \"ul\"\n  }, \"Circumstances: immediate or near-term factors that affect behavior and decision-making.\\nCustomers with the same jobs may make different decisions based on their job\\ndrivers.\")), mdx(\"p\", null, \"By combining jobs and job drivers, we can create \", mdx(\"em\", {\n    parentName: \"p\"\n  }, \"meaningful\"), \" customer segments.\"), mdx(\"blockquote\", null, mdx(\"p\", {\n    parentName: \"blockquote\"\n  }, \"What we care about are the drivers that lead to key jobs to be done.\")), mdx(\"h3\", null, \"Current Approaches and Pain Points\"), mdx(\"blockquote\", null, mdx(\"p\", {\n    parentName: \"blockquote\"\n  }, \"Understanding what customers do today and how they respond to various pain points broadens the solution space for both incremental and breakthrough solutions.\\nThe easiest way to make sure you are not missing a key stakeholder is to create a process map from the customer's perspective.\\nWe're looking for all of the steps between when a customer starts to think about a job to when they finish it. This helps to identify key stakeholders throughout the entire process. These maps should be created for particular occasions, not generic scenarios. When interviewing customers, I should ask about a specific instance, such as the \", mdx(\"em\", {\n    parentName: \"p\"\n  }, \"last time\"), \".\")), mdx(\"p\", null, \"The goal is to identify pain points, which are areas where the customer experiences frustration, boredom, or inefficiency.\"), mdx(\"p\", null, \"We need to design a solution that works with current customer behavior. Current behaviors, even strange or pointless ones, are difficult to work against. This is balanced somewhat by customers' desires to alleviate pain points.\"), mdx(\"p\", null, \"The key is to solve for real pain points that your customers experience, not perceived pain points that come from you.\"), mdx(\"blockquote\", null, mdx(\"p\", {\n    parentName: \"blockquote\"\n  }, \"Making a \\\"better\\\" product is the easy part of innovation. The hard part is ensuring that your new product is better for the right people in the right ways.\")));\n}\n;\nMDXContent.isMDXComponent = true;"},"note":{"authors":["Stephen Wunker","Jessica Wattman","David Farber"],"category":"Book","date":"2017-07-30","published":true,"slug":"jobs-to-be-done","source":"Jobs to be Done","title":"Jobs to Be Done","url":"https://smile.amazon.com/Jobs-Be-Done-Customer-Centered-Innovation/dp/0814438032?sa-no-redirect=1"}},"pageContext":{"id":"d7de923a-1ed0-5d2d-983c-2a2aac8e88b8","slug":"jobs-to-be-done","__params":{"slug":"jobs-to-be-done"}}},
    "staticQueryHashes": []}