{
    "componentChunkName": "component---src-pages-notes-note-slug-jsx",
    "path": "/notes/a-decade-of-stackoverflow/",
    "result": {"data":{"mdx":{"body":"var _excluded = [\"components\"];\n\nfunction _extends() { _extends = Object.assign || function (target) { for (var i = 1; i < arguments.length; i++) { var source = arguments[i]; for (var key in source) { if (Object.prototype.hasOwnProperty.call(source, key)) { target[key] = source[key]; } } } return target; }; return _extends.apply(this, arguments); }\n\nfunction _objectWithoutProperties(source, excluded) { if (source == null) return {}; var target = _objectWithoutPropertiesLoose(source, excluded); var key, i; if (Object.getOwnPropertySymbols) { var sourceSymbolKeys = Object.getOwnPropertySymbols(source); for (i = 0; i < sourceSymbolKeys.length; i++) { key = sourceSymbolKeys[i]; if (excluded.indexOf(key) >= 0) continue; if (!Object.prototype.propertyIsEnumerable.call(source, key)) continue; target[key] = source[key]; } } return target; }\n\nfunction _objectWithoutPropertiesLoose(source, excluded) { if (source == null) return {}; var target = {}; var sourceKeys = Object.keys(source); var key, i; for (i = 0; i < sourceKeys.length; i++) { key = sourceKeys[i]; if (excluded.indexOf(key) >= 0) continue; target[key] = source[key]; } return target; }\n\n/* @jsxRuntime classic */\n\n/* @jsx mdx */\nvar _frontmatter = {\n  \"title\": \"A Decade of StackOverflow\",\n  \"Authors\": \"David Fullerton\",\n  \"Published\": true,\n  \"Media\": {\n    \"id\": \"}L@k\",\n    \"name\": \"Live Talk\",\n    \"color\": \"default\"\n  },\n  \"Slug\": \"a-decade-of-stackoverflow\",\n  \"Source\": \"DeveloperWeek 2019\",\n  \"Date\": {\n    \"start\": \"2019-02-22T00:00:00.000Z\",\n    \"end\": null,\n    \"time_zone\": null\n  },\n  \"Category\": {\n    \"id\": \"7c590fdc-8922-4760-8d45-5b3cf6f6b991\",\n    \"name\": \"Development\",\n    \"color\": \"default\"\n  },\n  \"Type\": {\n    \"type\": \"string\",\n    \"string\": \"Note\"\n  },\n  \"URL\": \"https://www.developerweek.com/\"\n};\nvar layoutProps = {\n  _frontmatter: _frontmatter\n};\nvar MDXLayout = \"wrapper\";\nreturn function MDXContent(_ref) {\n  var components = _ref.components,\n      props = _objectWithoutProperties(_ref, _excluded);\n\n  return mdx(MDXLayout, _extends({}, layoutProps, props, {\n    components: components,\n    mdxType: \"MDXLayout\"\n  }), mdx(\"p\", null, \"One of the really interesting things about this talk was how candid it was.\"), mdx(\"blockquote\", null, mdx(\"p\", {\n    parentName: \"blockquote\"\n  }, \"It's about getting something out there that isn't perfect, learning what's not working, and having the courage to go back and rebuild the parts that aren't working.\")), mdx(\"h3\", null, \"Doing Just Enough\"), mdx(\"p\", null, \"All of StackOverflow runs on 9 web servers and 4 SQL Server boxes.\"), mdx(\"p\", null, \"An example is how they managed tag search. In the early days, instead of building a complicated tag management system, they simply did a \", mdx(\"inlineCode\", {\n    parentName: \"p\"\n  }, \"CONTAINS\"), \" statement in SQL. However, this doesn't work with special characters. Rather than complicate things, the simply substituted the special characters for word characters they weren't using (e.g. \", mdx(\"inlineCode\", {\n    parentName: \"p\"\n  }, \"c#\"), \" \\u2192 \", mdx(\"inlineCode\", {\n    parentName: \"p\"\n  }, \"c\\xF1\"), \"). This lasted a couple years, and solved the problem simply and quickly.\"), mdx(\"p\", null, \"The moral of the story: An early hack that solves a problem quickly can actually sustain you for a long time. Eventually, you may need to rebuild it, but you can do so with the full use case in mind.\"), mdx(\"h3\", null, \"Scaling the Community\"), mdx(\"p\", null, \"One of StackOverflow's biggest challenges hasn't been scaling technically, it's been scaling the community.\"), mdx(\"blockquote\", null, mdx(\"p\", {\n    parentName: \"blockquote\"\n  }, \"[As the community grows]\", \", the biggest thing you start to lose is a sense of empathy.\")), mdx(\"blockquote\", null, mdx(\"p\", {\n    parentName: \"blockquote\"\n  }, \"StackOverflow has long has this culture of \\\"being right is more important than being helpful.\\\"\")), mdx(\"p\", null, \"This ended up being one of the biggest challenges to scaling the community. They had to change the community to drive towards helpfulness as a shared value.\"), mdx(\"p\", null, \"The motto used to be \\\"StackOverflow is for professional programmers.\\\" This exclude a lot of people who don't feel like they belong to this group. It drives people away from the industry. This also hurts people from underrepresented groups.\"), mdx(\"p\", null, \"They're working to \\\"refactor a community.\\\"\"), mdx(\"ul\", null, mdx(\"li\", {\n    parentName: \"ul\"\n  }, \"This year, they rolled out a new code of conduct that emphasizes \\\"kindness, collaboration and mutual respect.\\\"\"), mdx(\"li\", {\n    parentName: \"ul\"\n  }, \"They added a way to enforce the code of conduct by adding a new flag (unfriendly or unkind).\"), mdx(\"li\", {\n    parentName: \"ul\"\n  }, \"They added a new contributor indicator to remind the community to be nice to someone who's new.\")), mdx(\"p\", null, \"The net change so far is new, unkind comments has dropped by a third.\"), mdx(\"h3\", null, \"Conclusion\"), mdx(\"p\", null, \"These things have a connection thread of a willing to go back and revisit old decisions. StackOverflow's success is driven by a willingness to listen to what people say and change.\"), mdx(\"blockquote\", null, mdx(\"p\", {\n    parentName: \"blockquote\"\n  }, \"Ask the right questions, and be willing to listen to the answers you get.\")));\n}\n;\nMDXContent.isMDXComponent = true;"},"note":{"authors":["David Fullerton"],"category":"Development","media":"Live Talk","date":"2019-02-22","published":true,"slug":"a-decade-of-stackoverflow","source":"DeveloperWeek 2019","title":"A Decade of StackOverflow","url":"https://www.developerweek.com/"}},"pageContext":{"id":"48fbcc2b-76e8-562a-b543-eff3937eb738","slug":"a-decade-of-stackoverflow","__params":{"slug":"a-decade-of-stackoverflow"}}},
    "staticQueryHashes": []}