{
    "componentChunkName": "component---src-pages-notes-note-slug-jsx",
    "path": "/notes/the-infinite-game/",
    "result": {"data":{"mdx":{"body":"var _excluded = [\"components\"];\n\nfunction _extends() { _extends = Object.assign || function (target) { for (var i = 1; i < arguments.length; i++) { var source = arguments[i]; for (var key in source) { if (Object.prototype.hasOwnProperty.call(source, key)) { target[key] = source[key]; } } } return target; }; return _extends.apply(this, arguments); }\n\nfunction _objectWithoutProperties(source, excluded) { if (source == null) return {}; var target = _objectWithoutPropertiesLoose(source, excluded); var key, i; if (Object.getOwnPropertySymbols) { var sourceSymbolKeys = Object.getOwnPropertySymbols(source); for (i = 0; i < sourceSymbolKeys.length; i++) { key = sourceSymbolKeys[i]; if (excluded.indexOf(key) >= 0) continue; if (!Object.prototype.propertyIsEnumerable.call(source, key)) continue; target[key] = source[key]; } } return target; }\n\nfunction _objectWithoutPropertiesLoose(source, excluded) { if (source == null) return {}; var target = {}; var sourceKeys = Object.keys(source); var key, i; for (i = 0; i < sourceKeys.length; i++) { key = sourceKeys[i]; if (excluded.indexOf(key) >= 0) continue; target[key] = source[key]; } return target; }\n\n/* @jsxRuntime classic */\n\n/* @jsx mdx */\nvar _frontmatter = {\n  \"title\": \"The Infinite Game\",\n  \"Authors\": \"Simon Sinek\",\n  \"Published\": true,\n  \"Media\": {\n    \"id\": \"650097b4-ead7-4703-a1dd-15e1ee9c8d02\",\n    \"name\": \"Book\",\n    \"color\": \"default\"\n  },\n  \"Slug\": \"the-infinite-game\",\n  \"Source\": \"The Infinite Game\",\n  \"Date\": {\n    \"start\": \"2020-02-11T00:00:00.000Z\",\n    \"end\": null,\n    \"time_zone\": null\n  },\n  \"Category\": {\n    \"id\": \"8bf2ef21-ce42-45ac-923f-5f29cde3a3c6\",\n    \"name\": \"Psychology\",\n    \"color\": \"default\"\n  },\n  \"Type\": {\n    \"type\": \"string\",\n    \"string\": \"Note\"\n  },\n  \"URL\": \"https://smile.amazon.com/Infinite-Game-Simon-Sinek/dp/073521350X\"\n};\nvar layoutProps = {\n  _frontmatter: _frontmatter\n};\nvar MDXLayout = \"wrapper\";\nreturn function MDXContent(_ref) {\n  var components = _ref.components,\n      props = _objectWithoutProperties(_ref, _excluded);\n\n  return mdx(MDXLayout, _extends({}, layoutProps, props, {\n    components: components,\n    mdxType: \"MDXLayout\"\n  }), mdx(\"p\", null, \"Below are some of the quotes that resonated with me from this book.\"), mdx(\"blockquote\", null, mdx(\"p\", {\n    parentName: \"blockquote\"\n  }, \"Where a finite-minded player makes products they think they can sell to people, the infinite-minded player makes products people want to buy.\"), mdx(\"p\", {\n    parentName: \"blockquote\"\n  }, \"...\"), mdx(\"p\", {\n    parentName: \"blockquote\"\n  }, \"To ask, \\u201Cwhat\\u2019s best for me?\\u201D is finite thinking. To ask, \\u201Cwhat\\u2019s best for us?\\u201D is infinite thinking.\")), mdx(\"blockquote\", null, mdx(\"p\", {\n    parentName: \"blockquote\"\n  }, \"Infinite-minded leaders understand that \\u201Cbest\\u201D is not a permanent state. Instead, they strive to be better. Better suggests a journey of constant improvement and makes us feel like we are being invited to contribute our talents and energies to make progress in that journey.\")), mdx(\"blockquote\", null, mdx(\"p\", {\n    parentName: \"blockquote\"\n  }, \"Money is the fuel to advance a cause; it is not a cause itself. The reason to grow is so we can have more fuel to advance the cause. Just like we don\\u2019t buy a car simply so we can buy more gas, so too must companies offer more value than their ability to make money.\")), mdx(\"blockquote\", null, mdx(\"p\", {\n    parentName: \"blockquote\"\n  }, \"Even well-minded finite leaders often have the perspective of making money to do good. An infinite perspective on service, however, looks somewhat different\\u2014do good to make money.\")), mdx(\"blockquote\", null, mdx(\"p\", {\n    parentName: \"blockquote\"\n  }, \"It\\u2019s a strange quirk of human nature\\u2014the order someone presents information more often than not reveals their actual priorities and the focus of their strategies.\")), mdx(\"blockquote\", null, mdx(\"p\", {\n    parentName: \"blockquote\"\n  }, \"The art of good leadership is the ability to look beyond the growth plan and the willingness to act prudently when something is not right, even if it means slowing things down.\")), mdx(\"blockquote\", null, mdx(\"p\", {\n    parentName: \"blockquote\"\n  }, \"When leaders use process to replace judgment, the conditions for ethical fading persist, even in cultures that hold themselves to higher moral and ethical standards.\")), mdx(\"blockquote\", null, mdx(\"p\", {\n    parentName: \"blockquote\"\n  }, \"When we view the other players as worthy rivals, it removes the pressure of being in a win-at-any-cost struggle. And so, by default, we feel less need to act unethically or illegally. Upholding the values by which we operate becomes more important than the score, which actually motivates us to be more honest.\")), mdx(\"blockquote\", null, mdx(\"p\", {\n    parentName: \"blockquote\"\n  }, \"An infinite mindset embraces abundance, whereas a finite mindset operates with a scarcity mentality. In the infinite game, we accept that bringing the best is a fool\\u2019s errand and that multiple players can do well at the same time.\")), mdx(\"blockquote\", null, mdx(\"p\", {\n    parentName: \"blockquote\"\n  }, \"Where the finite-minded player fears things that are disruptive, the infinite-minded player revels in them.\")));\n}\n;\nMDXContent.isMDXComponent = true;"},"note":{"authors":["Simon Sinek"],"category":"Psychology","date":"2020-02-11","published":true,"slug":"the-infinite-game","source":"The Infinite Game","title":"The Infinite Game","url":"https://smile.amazon.com/Infinite-Game-Simon-Sinek/dp/073521350X"}},"pageContext":{"id":"d19b4868-01e7-5106-bba0-20e04a78dc17","slug":"the-infinite-game","__params":{"slug":"the-infinite-game"}}},
    "staticQueryHashes": []}