{
    "componentChunkName": "component---src-pages-notes-note-slug-jsx",
    "path": "/notes/building-products-from-startup-to-scale/",
    "result": {"data":{"mdx":{"body":"var _excluded = [\"components\"];\n\nfunction _extends() { _extends = Object.assign || function (target) { for (var i = 1; i < arguments.length; i++) { var source = arguments[i]; for (var key in source) { if (Object.prototype.hasOwnProperty.call(source, key)) { target[key] = source[key]; } } } return target; }; return _extends.apply(this, arguments); }\n\nfunction _objectWithoutProperties(source, excluded) { if (source == null) return {}; var target = _objectWithoutPropertiesLoose(source, excluded); var key, i; if (Object.getOwnPropertySymbols) { var sourceSymbolKeys = Object.getOwnPropertySymbols(source); for (i = 0; i < sourceSymbolKeys.length; i++) { key = sourceSymbolKeys[i]; if (excluded.indexOf(key) >= 0) continue; if (!Object.prototype.propertyIsEnumerable.call(source, key)) continue; target[key] = source[key]; } } return target; }\n\nfunction _objectWithoutPropertiesLoose(source, excluded) { if (source == null) return {}; var target = {}; var sourceKeys = Object.keys(source); var key, i; for (i = 0; i < sourceKeys.length; i++) { key = sourceKeys[i]; if (excluded.indexOf(key) >= 0) continue; target[key] = source[key]; } return target; }\n\n/* @jsxRuntime classic */\n\n/* @jsx mdx */\nvar _frontmatter = {\n  \"title\": \"Improving Your Odds: building Products from Startup to Scale\",\n  \"Authors\": \"Chiara McPhee\",\n  \"Published\": true,\n  \"Category\": {\n    \"id\": \"}L@k\",\n    \"name\": \"Live Talk\",\n    \"color\": \"default\"\n  },\n  \"Slug\": \"building-products-from-startup-to-scale\",\n  \"Source\": \"DeveloperWeek 2019\",\n  \"Date\": {\n    \"start\": \"2019-02-21T00:00:00.000Z\",\n    \"end\": null,\n    \"time_zone\": null\n  },\n  \"Type\": {\n    \"type\": \"string\",\n    \"string\": \"Note\"\n  },\n  \"URL\": \"https://www.developerweek.com\"\n};\nvar layoutProps = {\n  _frontmatter: _frontmatter\n};\nvar MDXLayout = \"wrapper\";\nreturn function MDXContent(_ref) {\n  var components = _ref.components,\n      props = _objectWithoutProperties(_ref, _excluded);\n\n  return mdx(MDXLayout, _extends({}, layoutProps, props, {\n    components: components,\n    mdxType: \"MDXLayout\"\n  }), mdx(\"p\", null, mdx(\"strong\", {\n    parentName: \"p\"\n  }, \"90% of new products fail commercially.\"), \" This happens everywhere. Creating viable products is really hard.\"), mdx(\"p\", null, \"Why do products fail? There are a few main reasons.\"), mdx(\"ul\", null, mdx(\"li\", {\n    parentName: \"ul\"\n  }, mdx(\"em\", {\n    parentName: \"li\"\n  }, \"No market need:\"), \" 42%\"), mdx(\"li\", {\n    parentName: \"ul\"\n  }, mdx(\"em\", {\n    parentName: \"li\"\n  }, \"Ran out of cash:\"), \" 29%\"), mdx(\"li\", {\n    parentName: \"ul\"\n  }, mdx(\"em\", {\n    parentName: \"li\"\n  }, \"Team issues:\"), \" 23%\"), mdx(\"li\", {\n    parentName: \"ul\"\n  }, mdx(\"em\", {\n    parentName: \"li\"\n  }, \"Outcompeted:\"), \" 19%\")), mdx(\"p\", null, \"Chiara recommends a few steps to help mitigate this.\"), mdx(\"h3\", null, \"1. Listen to Your Customers\"), mdx(\"blockquote\", null, mdx(\"p\", {\n    parentName: \"blockquote\"\n  }, \"We have two ears and one mouth so we can listen twice as much as we speak. \\u2014Epictetus\")), mdx(\"p\", null, \"One of the biggest issues Chiara sees with the old workflow is that feedback is filtered from the customer to the project manager to the designer and finally to the engineer. This filters and dilutes the feedback engineers receive, kind of like playing telephone.\"), mdx(\"p\", null, \"In order to achieve true customer-centricity, everyone on the team should have access to customers (including engineers). This allows engineers to \", mdx(\"em\", {\n    parentName: \"p\"\n  }, \"understand the pain\"), \" and empathize with customers, which helps with motivation and improves the product quality.\"), mdx(\"p\", null, \"Customers also love this. It helps you ship products they love and value.\"), mdx(\"p\", null, \"Use a fake experience (\", mdx(\"em\", {\n    parentName: \"p\"\n  }, \"fake doors\"), \") that people opt into to assess demand. SendGrid also has a platform where customers can submit ideas directly.\"), mdx(\"h3\", null, \"2. Ship It, Then Send It\"), mdx(\"p\", null, \"Even the best people in the world struggle to create products. If you\"), mdx(\"ul\", null, mdx(\"li\", {\n    parentName: \"ul\"\n  }, \"Start with a steel thread: solves a small, discrete customer problem.\"), mdx(\"li\", {\n    parentName: \"ul\"\n  }, \"Get your steel thread in the hands of the customers ASAP.\"), mdx(\"li\", {\n    parentName: \"ul\"\n  }, \"Separate your product and marketing releases. This can go out much later than the first version of a product or feature.\")), mdx(\"p\", null, mdx(\"em\", {\n    parentName: \"p\"\n  }, \"Personal note: I need to do a much better job of understanding customer problems before deciding on a solution.\")), mdx(\"h3\", null, \"3. Measure & Iterate, Ad Infinitum\"), mdx(\"ul\", null, mdx(\"li\", {\n    parentName: \"ul\"\n  }, \"Measure your progress against clear metrics.\"), mdx(\"li\", {\n    parentName: \"ul\"\n  }, \"Make decisions with data Avoid HiPPOs (highest paid person's opinion).\"), mdx(\"li\", {\n    parentName: \"ul\"\n  }, \"Iterate towards an effective solution.\"), mdx(\"li\", {\n    parentName: \"ul\"\n  }, \"Paint a product vision, not a product roadmap. What you learn while you're iterating should \", mdx(\"em\", {\n    parentName: \"li\"\n  }, \"change\"), \" the developed features. A product vision is a series of guiding principles to influence where the product heads.\")), mdx(\"h3\", null, \"4. Invest in Your Team\"), mdx(\"blockquote\", null, mdx(\"p\", {\n    parentName: \"blockquote\"\n  }, \"Great companies heavily invest in culture and team. How we work together becomes more important than what we're working on.\"), mdx(\"ul\", {\n    parentName: \"blockquote\"\n  }, mdx(\"li\", {\n    parentName: \"ul\"\n  }, \"Choose teammates with shared values\"), mdx(\"li\", {\n    parentName: \"ul\"\n  }, \"Build connective tissue\"), mdx(\"li\", {\n    parentName: \"ul\"\n  }, \"Keep your team small and nimble\"), mdx(\"li\", {\n    parentName: \"ul\"\n  }, \"Trust your teammates and hold them accountable\"))), mdx(\"blockquote\", null, mdx(\"p\", {\n    parentName: \"blockquote\"\n  }, \"Autonomy without accountability is anarchy.\"), mdx(\"ol\", {\n    parentName: \"blockquote\"\n  }, mdx(\"li\", {\n    parentName: \"ol\"\n  }, \"Opportunity discovery JTBD interviews Understand point where somebody made a decision\"), mdx(\"li\", {\n    parentName: \"ol\"\n  }, \"Synthesize interviews a list of common and try to identify key problems.\"))));\n}\n;\nMDXContent.isMDXComponent = true;"},"note":{"authors":["Chiara McPhee"],"category":"Live Talk","date":"2019-02-21","published":true,"slug":"building-products-from-startup-to-scale","source":"DeveloperWeek 2019","title":"Improving Your Odds: building Products from Startup to Scale","url":"https://www.developerweek.com"}},"pageContext":{"id":"564f8f83-0307-5e64-acc4-2339e09e01c9","slug":"building-products-from-startup-to-scale","__params":{"slug":"building-products-from-startup-to-scale"}}},
    "staticQueryHashes": []}