{
    "componentChunkName": "component---src-pages-notes-note-slug-jsx",
    "path": "/notes/when-coffee-and-kale-compete/",
    "result": {"data":{"mdx":{"body":"var _excluded = [\"components\"];\n\nfunction _extends() { _extends = Object.assign || function (target) { for (var i = 1; i < arguments.length; i++) { var source = arguments[i]; for (var key in source) { if (Object.prototype.hasOwnProperty.call(source, key)) { target[key] = source[key]; } } } return target; }; return _extends.apply(this, arguments); }\n\nfunction _objectWithoutProperties(source, excluded) { if (source == null) return {}; var target = _objectWithoutPropertiesLoose(source, excluded); var key, i; if (Object.getOwnPropertySymbols) { var sourceSymbolKeys = Object.getOwnPropertySymbols(source); for (i = 0; i < sourceSymbolKeys.length; i++) { key = sourceSymbolKeys[i]; if (excluded.indexOf(key) >= 0) continue; if (!Object.prototype.propertyIsEnumerable.call(source, key)) continue; target[key] = source[key]; } } return target; }\n\nfunction _objectWithoutPropertiesLoose(source, excluded) { if (source == null) return {}; var target = {}; var sourceKeys = Object.keys(source); var key, i; for (i = 0; i < sourceKeys.length; i++) { key = sourceKeys[i]; if (excluded.indexOf(key) >= 0) continue; target[key] = source[key]; } return target; }\n\n/* @jsxRuntime classic */\n\n/* @jsx mdx */\nvar _frontmatter = {\n  \"title\": \"When Coffee and Kale Compete\",\n  \"Authors\": \"Alan Klement\",\n  \"Published\": true,\n  \"Media\": {\n    \"id\": \"650097b4-ead7-4703-a1dd-15e1ee9c8d02\",\n    \"name\": \"Book\",\n    \"color\": \"default\"\n  },\n  \"Slug\": \"when-coffee-and-kale-compete\",\n  \"Source\": \"Amazon\",\n  \"Date\": {\n    \"start\": \"2016-11-23T00:00:00.000Z\",\n    \"end\": null,\n    \"time_zone\": null\n  },\n  \"Category\": {\n    \"id\": \"f60b7960-389a-42f6-995a-2575d34f2e2a\",\n    \"name\": \"Business\",\n    \"color\": \"default\"\n  },\n  \"Type\": {\n    \"type\": \"string\",\n    \"string\": \"Note\"\n  },\n  \"URL\": \"https://www.amazon.com/When-Coffee-Kale-Compete-products/dp/1534873066/ref=tmm_pap_swatch_0?_encoding=UTF8&qid=&sr=\"\n};\nvar layoutProps = {\n  _frontmatter: _frontmatter\n};\nvar MDXLayout = \"wrapper\";\nreturn function MDXContent(_ref) {\n  var components = _ref.components,\n      props = _objectWithoutProperties(_ref, _excluded);\n\n  return mdx(MDXLayout, _extends({}, layoutProps, props, {\n    components: components,\n    mdxType: \"MDXLayout\"\n  }), mdx(\"h3\", null, \"Challenges and Hope\"), mdx(\"p\", null, \"Focus on two things:\"), mdx(\"ul\", null, mdx(\"li\", {\n    parentName: \"ul\"\n  }, \"\\u201CThe customers\\u2019 struggle to make life better.\\u201D\"), mdx(\"li\", {\n    parentName: \"ul\"\n  }, \"\\u201CHow customers imagine their lives being better when they have the right solution.\")), mdx(\"blockquote\", null, mdx(\"p\", {\n    parentName: \"blockquote\"\n  }, \"We can\\u2019t build the products of tomorrow by limiting ourselves to the needs and expectations associated with the products of today. \\u2026 When we focus on delivering customers\\u2019 progress\\u2014instead of what customers say they want\\u2014we are free to imagine a world where many needs and expectations have been replaced with new ones.\")), mdx(\"p\", null, \"Three principles of data:\"), mdx(\"ul\", null, mdx(\"li\", {\n    parentName: \"ul\"\n  }, mdx(\"strong\", {\n    parentName: \"li\"\n  }, \"All models is wrong, but some are useful.\")), mdx(\"li\", {\n    parentName: \"ul\"\n  }, \"The most important figures are unknown or knowable.\"), mdx(\"li\", {\n    parentName: \"ul\"\n  }, \"The data will tell you whatever story you \\u201Ctorture\\u201D out of them.\")), mdx(\"p\", null, mdx(\"strong\", {\n    parentName: \"p\"\n  }, \"Products do not last forever.\"), \" Groth for every product will eventually stop, because new solutions to customer needs will arise. In order to survive, you have to innovate and eventually canibalize your own product.\"), mdx(\"blockquote\", null, mdx(\"p\", {\n    parentName: \"blockquote\"\n  }, \"The singular attention to customer motivation\\u2014instead of what customers say they want, their demographics, or what they do\\u2014is what distinguishes JTBD from other theories.\")), mdx(\"h3\", null, \"What is JTBD?\"), mdx(\"p\", null, mdx(\"strong\", {\n    parentName: \"p\"\n  }, \"The goal is to understand how and why customers struggle.\")), mdx(\"p\", null, \"The gap: where customers are now \\uFFFC\\uFFFC\\u21D4 where customers want to be\"), mdx(\"p\", null, mdx(\"strong\", {\n    parentName: \"p\"\n  }, \"Job:\"), \" \\u201CA job is one\\u2019s emotional struggle to make life better.\\u201D\\n\", mdx(\"strong\", {\n    parentName: \"p\"\n  }, \"Done:\"), \" \\u201CIt\\u2019s done when one finds the right solution to overcome that struggle and make that better life happen.\\u201D\"), mdx(\"p\", null, \"This gap creates a \", mdx(\"em\", {\n    parentName: \"p\"\n  }, \"job\"), \". The job is \", mdx(\"em\", {\n    parentName: \"p\"\n  }, \"done\"), \" when the customer has a solution that takes them across the gap.\"), mdx(\"p\", null, mdx(\"em\", {\n    parentName: \"p\"\n  }, \"With cars, the question to ask is, \\u201CHow did you come to realize you needed a car instead of some other form of transportation? How does owning a car make your life better?\\u201D\")), mdx(\"p\", null, \"Needs change. You have to be aware of how customers needs\\u2019 evolve and be prepared to change your business to meet them.\"), mdx(\"p\", null, mdx(\"em\", {\n    parentName: \"p\"\n  }, \"A JTBD describes a \", mdx(\"strong\", {\n    parentName: \"em\"\n  }, \"motivation\"), \", not a__ functionality\"), \". You need to think about \", mdx(\"em\", {\n    parentName: \"p\"\n  }, \"why\"), \" a customer is doing something, not the specific way that they\\u2019re doing it? Why? Because if you reframe things to this perspective, you can find new, innovative ways of fulfilling this motivation.**\"), mdx(\"blockquote\", null, mdx(\"p\", {\n    parentName: \"blockquote\"\n  }, \"Breakthrough innovations happen when you reimagine or eliminate activities and functionality, not when you design for it.\")), mdx(\"blockquote\", null, mdx(\"p\", {\n    parentName: \"blockquote\"\n  }, \"You are stuck in the world of today when you focus on functionality, activities and tasks. \\u2026 Breakthrough innovations happen when you reimagine or eliminate activities and functionality, not when you design for it.\")), mdx(\"p\", null, mdx(\"em\", {\n    parentName: \"p\"\n  }, \"Note: I need to reframe my thoughts like this. I\\u2019ve been focusing so much on solutions and so little on motivations it\\u2019s not wonder I haven\\u2019t hit on anything innovative yet.\")), mdx(\"p\", null, \"It\\u2019s imperative to force yourself into the motivation mindset. \", mdx(\"strong\", {\n    parentName: \"p\"\n  }, \"Focusing on functionality or tasks is easy, but wrong.\")), mdx(\"p\", null, \"What are the Principles of JTBD?\"), mdx(\"ul\", null, mdx(\"li\", {\n    parentName: \"ul\"\n  }, mdx(\"strong\", {\n    parentName: \"li\"\n  }, \"\\u201CCustomers don\\u2019t want your product or what it does; they want help making their lives better.\\u201D\"), \" Focusing on the product itself and ignoring the motivation limits your ability to innovate.\"), mdx(\"li\", {\n    parentName: \"ul\"\n  }, mdx(\"strong\", {\n    parentName: \"li\"\n  }, \"\\u201CPeople have jobs; things don\\u2019t.\\u201D\"), \" The job is all about the person, not improving a thing.\"), mdx(\"li\", {\n    parentName: \"ul\"\n  }, mdx(\"strong\", {\n    parentName: \"li\"\n  }, \"\\u201CCompetition is defined in the minds of customers, and they use progress as their criteria.\\u201D\"), \" This is a hugely important point.\"), mdx(\"li\", {\n    parentName: \"ul\"\n  }, mdx(\"strong\", {\n    parentName: \"li\"\n  }, \"\\u201CWhen customers start using a solution for a JTBD, they stop using something else.\\u201D\")), mdx(\"li\", {\n    parentName: \"ul\"\n  }, mdx(\"strong\", {\n    parentName: \"li\"\n  }, \"\\u201CInnovation opportunities exist when customers exhibit compensatory behaviors.\\u201D\"), \" Sometimes people use products to solve different jobs than what they were indented for. That\\u2019s okay. Capitalize on it.\"), mdx(\"li\", {\n    parentName: \"ul\"\n  }, mdx(\"strong\", {\n    parentName: \"li\"\n  }, \"\\u201CSolutions come and go, while jobs stay largely the same.\\u201D\"), \" Human motivation changes slowly.\"), mdx(\"li\", {\n    parentName: \"ul\"\n  }, mdx(\"strong\", {\n    parentName: \"li\"\n  }, \"\\u201CFavor progress over outcomes and goals.\\u201D\"), \" Customers need to feel successful the whole time they\\u2019re using your product, not just at the end.\"), mdx(\"li\", {\n    parentName: \"ul\"\n  }, mdx(\"strong\", {\n    parentName: \"li\"\n  }, \"\\u201CProgress defines value; contrast reveals value.\\u201D\"), \" It\\u2019s not enough to ask a customer about a product. You also have to define a context for them to think about it in.\"), mdx(\"li\", {\n    parentName: \"ul\"\n  }, mdx(\"strong\", {\n    parentName: \"li\"\n  }, \"\\u201CSolutions for jobs deliver value beyond the moment of use.\\u201D\"), \" You need to think about how a product improves a person\\u2019s life, even when it\\u2019s not being directly used.\"), mdx(\"li\", {\n    parentName: \"ul\"\n  }, mdx(\"strong\", {\n    parentName: \"li\"\n  }, \"\\u201CSolutions and jobs should be thought of as part of a system that work together to deliver progress to customers.\\u201D\"), \" You have to consider how everything works together, not how it operates on its own.\")), mdx(\"h4\", null, \"Case Study: Dan and Clarity\"), mdx(\"p\", null, mdx(\"strong\", {\n    parentName: \"p\"\n  }, \"\\u201CAsk customers what they\\u2019ve done, not just what they want.\\u201D\"), \" Otherwise, customers only tell us what we want to hear.**\"), mdx(\"blockquote\", null, mdx(\"p\", {\n    parentName: \"blockquote\"\n  }, \"I always give the analogy of being a retail shop owner and hiding in the hack room and trying to learn from your customers by watching the closed-circuit television. You could watch \", \"[customers]\", \" come in, walk around your store, pick up things, put them down, try things on\\u2026 or you could just walk out and ask them, \\u2018Hey, what brought you in here today? What are you looking for? What other places did you try in the past?\\u2019 Talking to customers about their motivations is where you\\u2019re going to learn the most. \\u2014Dan Martell\")), mdx(\"h4\", null, \"Case Study: Anthony and Form Theatricals\"), mdx(\"p\", null, \"The job helps to create the constraints for the product. It\\u2019s much easier to design something for a specific purpose rather than as a general statement.\"), mdx(\"blockquote\", null, mdx(\"p\", {\n    parentName: \"blockquote\"\n  }, \"It\\u2019s interesting to me because helping writers understand what job parents are using their play for is more powerful than saying to them, \\u2018Write a movie, or write a play that a nine-year-old will like.\\u2019 When we know that parents have a job that involves their struggle to teach their children life lessons in an entertaining way, we can work with our clients to help them craft their content better. When we present it as a job to be done, the artist has a lot of leeway around what the story should do. \\u2014Anthony Francavilla\")), mdx(\"p\", null, mdx(\"strong\", {\n    parentName: \"p\"\n  }, \"By understanding the underlying motivations of people, you can design products that serve those motivations.\")), mdx(\"p\", null, \"When a customer describes a struggle, dig in. Ask them for specific examples.\"), mdx(\"p\", null, mdx(\"strong\", {\n    parentName: \"p\"\n  }, \"Learn customer expectations at the point of purchase or first use.\")), mdx(\"p\", null, \"\\u201CBe suspicious of the \\u2018impulse purchase\\u2019 concept. No purchase is random.\\u201D\"), mdx(\"h4\", null, \"Case Study: Morgan and YourGrocer\"), mdx(\"p\", null, \"\\u201CHow can you beat the competition? Eliminate the need for a customer to make a trade-off.\\u201D\"), mdx(\"p\", null, \"You can\\u2019t depend on demographics. Oftentimes, what you think are attributes of your customers don\\u2019t match up with reality. \", mdx(\"strong\", {\n    parentName: \"p\"\n  }, \"\\u201CIt was the customers\\u2019 situation\\u2014not personal characteristics\\u2014that determined why they bought.\\u201D\")), mdx(\"p\", null, mdx(\"strong\", {\n    parentName: \"p\"\n  }, \"It\\u2019s not enough to observe customer behavior. You \"), mdx(\"em\", {\n    parentName: \"p\"\n  }, mdx(\"strong\", {\n    parentName: \"em\"\n  }, \"have\")), mdx(\"strong\", {\n    parentName: \"p\"\n  }, \" to talk to them and understand why.\")), mdx(\"h3\", null, \"The Forces of Progress\"), mdx(\"ul\", null, mdx(\"li\", {\n    parentName: \"ul\"\n  }, \"*Forces of progress: **The \", mdx(\"em\", {\n    parentName: \"li\"\n  }, \"emotional __forces that generate and shape a customer\\u2019s demand for a product.\"))), mdx(\"p\", null, \"Four fundamental forces:\"), mdx(\"ul\", null, mdx(\"li\", {\n    parentName: \"ul\"\n  }, mdx(\"p\", {\n    parentName: \"li\"\n  }, mdx(\"strong\", {\n    parentName: \"p\"\n  }, \"Push:\"), \" People change only when circumstances push them to be unhappy with where they are.\"), mdx(\"ul\", {\n    parentName: \"li\"\n  }, mdx(\"li\", {\n    parentName: \"ul\"\n  }, mdx(\"strong\", {\n    parentName: \"li\"\n  }, \"External pushes:\"), \" A person\\u2019s life has changed, and the old way of solving a problem has not changed with it.\"), mdx(\"li\", {\n    parentName: \"ul\"\n  }, mdx(\"strong\", {\n    parentName: \"li\"\n  }, \"Internal pushes:\"), \" The customer decides for themselves that they want to make a change in how things are.\"))), mdx(\"li\", {\n    parentName: \"ul\"\n  }, mdx(\"p\", {\n    parentName: \"li\"\n  }, mdx(\"strong\", {\n    parentName: \"p\"\n  }, \"Pull:\"), \" The push powers the change, but the pull directs where it goes.\"), mdx(\"ul\", {\n    parentName: \"li\"\n  }, mdx(\"li\", {\n    parentName: \"ul\"\n  }, mdx(\"strong\", {\n    parentName: \"li\"\n  }, \"The pull for a better life:\"), \" You need to be able to answer \\u201CHow will customers\\u2019 lives improve when they have the right solution for their struggle?\\u201D It sometimes takes people a while to get to a point where they\\u2019re ready for this.\"), mdx(\"li\", {\n    parentName: \"ul\"\n  }, mdx(\"strong\", {\n    parentName: \"li\"\n  }, \"The pull toward a solution:\"), \" This is what drives a customer to a particular solution. It really depends on the context of the push.\"))), mdx(\"li\", {\n    parentName: \"ul\"\n  }, mdx(\"p\", {\n    parentName: \"li\"\n  }, mdx(\"strong\", {\n    parentName: \"p\"\n  }, \"Anxiety:\"), \" Apprehensions of the customer about buying and using your product.\"), mdx(\"ul\", {\n    parentName: \"li\"\n  }, mdx(\"li\", {\n    parentName: \"ul\"\n  }, mdx(\"strong\", {\n    parentName: \"li\"\n  }, \"Anxiety-in-choice:\"), \" When the customer doesn\\u2019t know if the product can help them get their job done. This exists only when we\\u2019ve never used a particular product before. People goes through \", mdx(\"em\", {\n    parentName: \"li\"\n  }, \"mental simulations\"), \" and experience anxieties as a result. \", mdx(\"em\", {\n    parentName: \"li\"\n  }, \"These anxieties drive away first-time customers.\"), \" They can be reduced with trials, refunds and discounts.\"), mdx(\"li\", {\n    parentName: \"ul\"\n  }, mdx(\"strong\", {\n    parentName: \"li\"\n  }, \"Anxiety-in-use:\"), \" When the user knows a product can deliver progress, but certain qualities make them nervous about using it. \", mdx(\"em\", {\n    parentName: \"li\"\n  }, \"These anxieties drive away repeat customers.\")))), mdx(\"li\", {\n    parentName: \"ul\"\n  }, mdx(\"p\", {\n    parentName: \"li\"\n  }, mdx(\"strong\", {\n    parentName: \"p\"\n  }, \"Habits:\"), \" Existing practices people perform that prevent them from adopting a new product.\"), mdx(\"ul\", {\n    parentName: \"li\"\n  }, mdx(\"li\", {\n    parentName: \"ul\"\n  }, mdx(\"strong\", {\n    parentName: \"li\"\n  }, \"Habits-in-choice:\"), \" Forces that exist at the moment of decision and prevent a customer from switching from one product to another.\"), mdx(\"li\", {\n    parentName: \"ul\"\n  }, mdx(\"strong\", {\n    parentName: \"li\"\n  }, \"Habits-in-use:\"), \" People switch back to previous solutions not because they\\u2019re better, but because customers find that keeping their old habits is \", mdx(\"em\", {\n    parentName: \"li\"\n  }, \"easier\"), \".\")))), mdx(\"p\", null, mdx(\"strong\", {\n    parentName: \"p\"\n  }, \"Push and pull must work together in harmony.\"), \" The easiest way to get started is by studying pushes and pulls.\"), mdx(\"p\", null, \"The bottom two forces are often overlooked. They shouldn\\u2019t be. \", mdx(\"strong\", {\n    parentName: \"p\"\n  }, \"Habits and anxieties are silent competitors.\"), \" They\\u2019re just as powerful and threatening as actual competitors in the market. Moreover, solving customers\\u2019 habits is often an easy win.\"), mdx(\"p\", null, \"Customer mental evaluation process:\"), mdx(\"ol\", null, mdx(\"li\", {\n    parentName: \"ol\"\n  }, \"Customer makes sense of their current problem.\"), mdx(\"li\", {\n    parentName: \"ol\"\n  }, \"They try to environ how life will be better when they overcome that problem.\"), mdx(\"li\", {\n    parentName: \"ol\"\n  }, \"They simulate what it is like to use a product and its effect on their struggle.\")), mdx(\"p\", null, \"Jobs Remain While Solutions Come and Go\"), mdx(\"blockquote\", null, mdx(\"p\", {\n    parentName: \"blockquote\"\n  }, \"Every product is born with an expiration date. Why? The world is constantly changing.\")), mdx(\"p\", null, mdx(\"strong\", {\n    parentName: \"p\"\n  }, \"Customer motivations rarely change, but how customers satisfy their motivations does.\")), mdx(\"p\", null, \"Question: \\u201CWhy are industry giants often forced off their own turf by small, young companies or industry outsiders?\\u201D\"), mdx(\"ol\", null, mdx(\"li\", {\n    parentName: \"ol\"\n  }, \"The company becomes complacent and narrow-minded towards competition.\"), mdx(\"li\", {\n    parentName: \"ol\"\n  }, \"With high barriers to entry, new entrants can only gain marketshare by inventing better and different ways of doing things.\"), mdx(\"li\", {\n    parentName: \"ol\"\n  }, \"As sales decline, incumbents are forced to either abandon their successful business model or reinvent it.\")), mdx(\"p\", null, \"This process is called \", mdx(\"strong\", {\n    parentName: \"p\"\n  }, \"creative destruction\"), \". It\\u2019s \", mdx(\"em\", {\n    parentName: \"p\"\n  }, \"cyclical \"), \"and \", mdx(\"em\", {\n    parentName: \"p\"\n  }, \"inevitable\"), \".\"), mdx(\"blockquote\", null, mdx(\"p\", {\n    parentName: \"blockquote\"\n  }, \"We should define which products compete against each other by whatever solutions customers believe they can use to get a job done.\")), mdx(\"blockquote\", null, mdx(\"p\", {\n    parentName: \"blockquote\"\n  }, \"You unlock your imagination as an innovator when you focus on why customers are trying to improve their lives.\")), mdx(\"p\", null, mdx(\"em\", {\n    parentName: \"p\"\n  }, \"Focus on what doesn\\u2019t change. That\\u2019s how you find the underlying job.\")), mdx(\"p\", null, \"Be sure you understand what customers will stop doing when they start using your product. Understand the shift in perspective they have to undergo.\"), mdx(\"h3\", null, \"When You Define Competition Wrong\"), mdx(\"p\", null, \"Common mistakes when applying jobs to be done:\"), mdx(\"ul\", null, mdx(\"li\", {\n    parentName: \"ul\"\n  }, \"Limiting my definition of competition to products that look and function similarly.\"), mdx(\"li\", {\n    parentName: \"ul\"\n  }, \"Not make sure a real struggle was taking place that customers were willing\\u2014and able\\u2014to pay for a solution.\"), mdx(\"li\", {\n    parentName: \"ul\"\n  }, \"Discounting information in customer interviews that contradicts your initial prejudices.\"), mdx(\"li\", {\n    parentName: \"ul\"\n  }, \"Oversimplifying the competitive landscape. You have to go beyond products that look and function similarly.\"), mdx(\"li\", {\n    parentName: \"ul\"\n  }, \"\\u201CNot every JTBD needs to be solved with a product that customers buy. Perhaps the most common reason that an innovation fails is that no one wants it.\\u201D\")), mdx(\"p\", null, \"Know where the budget comes from. If you\\u2019re going to charge customers for a product, that money will be pulled from something else.\"), mdx(\"blockquote\", null, mdx(\"p\", {\n    parentName: \"blockquote\"\n  }, \"JTBD rejects the idea of nonusers or non-consumption. Just because consumers aren\\u2019t using your product, or another product of same type, doesn\\u2019t mean they are nonusers. This is another big difference between JTBD and other approaches to markets and innovation. JTBD insists that if consumers have a JTBD, they must be using \", mdx(\"em\", {\n    parentName: \"p\"\n  }, \"something \"), \"for it.\")), mdx(\"blockquote\", null, mdx(\"p\", {\n    parentName: \"blockquote\"\n  }, \"You will become a better innovator when you recognize that innovation is hard, there are no recipes for success, and there\\u2019s no \\u201Cone right way\\u201D to make products and build businesses.\")), mdx(\"p\", null, \"JTBD isn\\u2019t about selling a \\u201Crecipe\\u201D for success. Instead, it focuses on:\"), mdx(\"ul\", null, mdx(\"li\", {\n    parentName: \"ul\"\n  }, \"What customers are struggling with\"), mdx(\"li\", {\n    parentName: \"ul\"\n  }, \"How they imagine their life being better when they have the right solution\"), mdx(\"li\", {\n    parentName: \"ul\"\n  }, \"What they do and don\\u2019t value in a solution.\")), mdx(\"h4\", null, \"Case Study: Omar and Transcendent Endeavors\"), mdx(\"p\", null, mdx(\"em\", {\n    parentName: \"p\"\n  }, \"This is a fantastic example of starting with nothing and forming a solution.\")), mdx(\"p\", null, \"If you\\u2019re starting with a problem and trying to identify the target market, look for who\\u2019s putting the most energy into trying to find a solution for that problem.\"), mdx(\"p\", null, \"When you interview someone, look for evidence of a struggle. If you can\\u2019t find it, there\\u2019s probably not an opportunity.\"), mdx(\"p\", null, \"How to put it into practice.\"), mdx(\"ol\", null, mdx(\"li\", {\n    parentName: \"ol\"\n  }, \"\\u201CBegin by identifying a struggle. Start wide, and get progressively narrow.\\u201D This also applies to \", mdx(\"em\", {\n    parentName: \"li\"\n  }, \"who\"), \" is struggling the most. You don\\u2019t have to know off the top of your head.\"), mdx(\"li\", {\n    parentName: \"ol\"\n  }, \"\\u201CFind innovation opportunities when customers exhibit compensatory behaviors.\\u201D\"), mdx(\"li\", {\n    parentName: \"ol\"\n  }, \"Learn how customers imagine their lives being better.\"), mdx(\"li\", {\n    parentName: \"ol\"\n  }, \"Identify what customers value in a solution.\")), mdx(\"h4\", null, \"Case Study: Justin and Product People Club\"), mdx(\"p\", null, mdx(\"strong\", {\n    parentName: \"p\"\n  }, \"Note: I should come back and reread this case study when I get closer to this point.\")), mdx(\"p\", null, \"It\\u2019s really important to focus on the \", mdx(\"em\", {\n    parentName: \"p\"\n  }, \"emotional\"), \" motivations of users. It\\u2019s not just a purely functional thing. People consume products to make them feel certain ways.\"), mdx(\"p\", null, \"Some places to look for struggle:\"), mdx(\"ul\", null, mdx(\"li\", {\n    parentName: \"ul\"\n  }, \"What are people complaining about on Twitter?\"), mdx(\"li\", {\n    parentName: \"ul\"\n  }, \"What topics are talked about during meet ups?\")), mdx(\"p\", null, \"Some questions to ask your customers:\"), mdx(\"ul\", null, mdx(\"li\", {\n    parentName: \"ul\"\n  }, \"How did you first hear about X?\"), mdx(\"li\", {\n    parentName: \"ul\"\n  }, \"When did you first think about using X?\"), mdx(\"li\", {\n    parentName: \"ul\"\n  }, \"What was going on in your live when you signed up for X?\"), mdx(\"li\", {\n    parentName: \"ul\"\n  }, \"What did you try before using X?\")), mdx(\"p\", null, \"Once you solve one of your customers jobs, the next question is \\u201Cwhat will these customers struggle with next?\\u201D\"), mdx(\"p\", null, \"It\\u2019s important to look for deep struggle rather than casual struggle. Look for people who are putting a lot of energy into a solution.\"), mdx(\"blockquote\", null, mdx(\"p\", {\n    parentName: \"blockquote\"\n  }, \"Aspiring entrepreneurs and innovators often move too quickly from observing a problem to hypothesizing a solution.\")), mdx(\"h4\", null, \"Case Study: Ash and the Lean Stack\"), mdx(\"p\", null, \"You don\\u2019t have to change your existing product to increase revenue. Instead, you can create new, complimentary products that solve additional jobs. Changing the existing product can risk turning the product into a Swiss-army knife that doesn\\u2019t do anything particularly well. Ask the question: \\u201CWhat comes after?\\u201D\"), mdx(\"blockquote\", null, mdx(\"p\", {\n    parentName: \"blockquote\"\n  }, \"Shift from selling one product to selling a combination of products that work together as a system.\")), mdx(\"h3\", null, \"The System of Progress\"), mdx(\"blockquote\", null, mdx(\"p\", {\n    parentName: \"blockquote\"\n  }, \"Anyone who views innovation and customer motivation through the lens of systems thinking will gain a better understanding of how great products are created and sold.\"), mdx(\"ul\", {\n    parentName: \"blockquote\"\n  }, mdx(\"li\", {\n    parentName: \"ul\"\n  }, \"*Interdependence: **All parts of a system form some kind of connection with each other.\"))), mdx(\"blockquote\", null, mdx(\"p\", {\n    parentName: \"blockquote\"\n  }, \"You do not help customers make progress by optimizing parts of the system of progress individually. You improve the system by optimizing how those parts work together.\"), mdx(\"ol\", {\n    parentName: \"blockquote\"\n  }, mdx(\"li\", {\n    parentName: \"ol\"\n  }, mdx(\"strong\", {\n    parentName: \"li\"\n  }, \"Realize a struggle (customer):\"), \" My responsibility is to understand the struggle.\"), mdx(\"li\", {\n    parentName: \"ol\"\n  }, mdx(\"strong\", {\n    parentName: \"li\"\n  }, \"Search for and choose a solution (producer):\"), \" This section is where the best customer data comes from. You can learn what customers value in a solution and their priorities.\"), mdx(\"li\", {\n    parentName: \"ol\"\n  }, mdx(\"strong\", {\n    parentName: \"li\"\n  }, \"Use solution against the struggle (producer):\"), \" This is where the engineers and designers take over for the marketers and create the products.\"), mdx(\"li\", {\n    parentName: \"ol\"\n  }, mdx(\"strong\", {\n    parentName: \"li\"\n  }, \"Realize a better life (customer):\"), \" If the solution solves the customers\\u2019 problems, then their job is done and they have a better life. Be sure to check that the customers got the life they were looking for.\"))), mdx(\"p\", null, \"This is a \", mdx(\"em\", {\n    parentName: \"p\"\n  }, \"continuous cycle\"), \". A solution often leads to new struggles, or the person is freed to focus on other struggles. This happens over and over. There are always opportunities as an entrepreneur because the system is continuously evolving\"), mdx(\"p\", null, \"As a customer evolves, a product that was a bad fit can become a good fit for them.\"), mdx(\"p\", null, mdx(\"strong\", {\n    parentName: \"p\"\n  }, \"Opportunities exist when moving forward and backward in a system of progress.\"), \" Ask \\u201Cwhat came before?\\u201D and \\u201Cwhat comes next?\\u201D You only need to tackle a slice of the system, but try to think of it as a whole.\"), mdx(\"h3\", null, \"Innovation and the System of Progress\"), mdx(\"blockquote\", null, mdx(\"p\", {\n    parentName: \"blockquote\"\n  }, \"An innovator\\u2019s responsibility is to study and improve the system. \\u2026 The customer does not understand the system.\")), mdx(\"p\", null, \"It\\u2019s important to see a customer\\u2019s wants as a symptom of a problem, not the problem itself. Your job as an innovator is to identify the underlying cause and solve that.\"), mdx(\"blockquote\", null, mdx(\"p\", {\n    parentName: \"blockquote\"\n  }, \"Doctors are able to treat patients successfully because they understand that the pains and discomforts that patients express are not the problem; they represent the patients\\u2019 interactions with their own bodies. Similarly, the needs, wants, and desired outcomes that customers express do not represent their problem; they represent the interactions between the customer and the system of progress. This is why customers\\u2019 stated preferences are unreliable and why customers\\u2019 \\u201Cneeds\\u201D and \\u201Cwants\\u201D keep changing.\")), mdx(\"p\", null, mdx(\"em\", {\n    parentName: \"p\"\n  }, \"Customers can tell you about their struggle, but not how to solve it. The bottom line is they simply don\\u2019t have enough information to completely solve the problem on their own.\")), mdx(\"p\", null, mdx(\"strong\", {\n    parentName: \"p\"\n  }, \"You don\\u2019t improve parts of a system, you improve the whole. The system is interdependent.\")), mdx(\"ul\", null, mdx(\"li\", {\n    parentName: \"ul\"\n  }, \"Systems can have fragile dependencies. If the dependencies change, the system can break.\"), mdx(\"li\", {\n    parentName: \"ul\"\n  }, \"Small changes can quickly cascade to larger and larger changes to a system.\")));\n}\n;\nMDXContent.isMDXComponent = true;"},"note":{"authors":["Alan Klement"],"category":"Business","date":"2016-11-23","published":true,"slug":"when-coffee-and-kale-compete","source":"Amazon","title":"When Coffee and Kale Compete","url":"https://www.amazon.com/When-Coffee-Kale-Compete-products/dp/1534873066/ref=tmm_pap_swatch_0?_encoding=UTF8&qid=&sr="}},"pageContext":{"id":"448b2872-19b6-5543-8b36-b2f584e9fcad","slug":"when-coffee-and-kale-compete","__params":{"slug":"when-coffee-and-kale-compete"}}},
    "staticQueryHashes": []}