{
    "componentChunkName": "component---src-pages-notes-note-slug-jsx",
    "path": "/notes/one-minute-manager/",
    "result": {"data":{"mdx":{"body":"var _excluded = [\"components\"];\n\nfunction _extends() { _extends = Object.assign || function (target) { for (var i = 1; i < arguments.length; i++) { var source = arguments[i]; for (var key in source) { if (Object.prototype.hasOwnProperty.call(source, key)) { target[key] = source[key]; } } } return target; }; return _extends.apply(this, arguments); }\n\nfunction _objectWithoutProperties(source, excluded) { if (source == null) return {}; var target = _objectWithoutPropertiesLoose(source, excluded); var key, i; if (Object.getOwnPropertySymbols) { var sourceSymbolKeys = Object.getOwnPropertySymbols(source); for (i = 0; i < sourceSymbolKeys.length; i++) { key = sourceSymbolKeys[i]; if (excluded.indexOf(key) >= 0) continue; if (!Object.prototype.propertyIsEnumerable.call(source, key)) continue; target[key] = source[key]; } } return target; }\n\nfunction _objectWithoutPropertiesLoose(source, excluded) { if (source == null) return {}; var target = {}; var sourceKeys = Object.keys(source); var key, i; for (i = 0; i < sourceKeys.length; i++) { key = sourceKeys[i]; if (excluded.indexOf(key) >= 0) continue; target[key] = source[key]; } return target; }\n\n/* @jsxRuntime classic */\n\n/* @jsx mdx */\nvar _frontmatter = {\n  \"title\": \"The New One Minute Manager\",\n  \"Authors\": \"Ken Blanchard, Spencer Johnson\",\n  \"Published\": true,\n  \"Category\": {\n    \"id\": \"650097b4-ead7-4703-a1dd-15e1ee9c8d02\",\n    \"name\": \"Book\",\n    \"color\": \"default\"\n  },\n  \"Slug\": \"one-minute-manager\",\n  \"Source\": \"The New One Minute Manager\",\n  \"Date\": {\n    \"start\": \"2019-07-31T00:00:00.000Z\",\n    \"end\": null,\n    \"time_zone\": null\n  },\n  \"Type\": {\n    \"type\": \"string\",\n    \"string\": \"Note\"\n  },\n  \"URL\": \"https://smile.amazon.com/New-One-Minute-Manager-ebook/dp/B00MMG19OG\"\n};\nvar layoutProps = {\n  _frontmatter: _frontmatter\n};\nvar MDXLayout = \"wrapper\";\nreturn function MDXContent(_ref) {\n  var components = _ref.components,\n      props = _objectWithoutProperties(_ref, _excluded);\n\n  return mdx(MDXLayout, _extends({}, layoutProps, props, {\n    components: components,\n    mdxType: \"MDXLayout\"\n  }), mdx(\"p\", null, \"When it comes to managers, there's the \\\"tough\\\" autocrat and the \\\"nice\\\" democrat. You need both perspectives to be a good manager.\"), mdx(\"h3\", null, \"Goals\"), mdx(\"p\", null, \"The goal is to facilitate in helping others to make decisions, not to make the decisions for them. You should \", mdx(\"em\", {\n    parentName: \"p\"\n  }, \"show\"), \" an individual how to do something, not do it for them.\"), mdx(\"p\", null, \"After a while, you shouldn't need to participate as much. Your aim is to build autonomy and self-reliance, which necessitates stepping back.\"), mdx(\"p\", null, \"Goals should be described briefly and clearly. Part of the manager's job is to define what good performance looks like. Ask the employee to review their goals each day, and to look at what they're doing and see if it's in line. If someone's behavior is out of line with their goals, ask them to re-evaluate it so they can realize their goals sooner.\"), mdx(\"h3\", null, \"Praisings\"), mdx(\"p\", null, \"Your aim is to show in \", mdx(\"em\", {\n    parentName: \"p\"\n  }, \"very specific terms\"), \" what a person is and isn't doing well. It's a lot easier for someone to do well if they have crystal clear feedback on how they're doing. Feedback is invaluable too\\u2014it will help them succeed.\"), mdx(\"blockquote\", null, mdx(\"p\", {\n    parentName: \"blockquote\"\n  }, \"Help people reach their full potential\\u2014catch them doing something right.\")), mdx(\"p\", null, \"Praise should happen \", mdx(\"em\", {\n    parentName: \"p\"\n  }, \"as soon as possible\"), \". When you notice someone doing something right, tell them precisely what it was and how good it made you feel. By specifying exactly what someone is doing, they know you're being sincere. It also shows consistency.\"), mdx(\"p\", null, \"Finally, you should pause to let the other person feel good, make it clear you have confidence in them, and encourage them to do more of the same.\"), mdx(\"h3\", null, \"Redirects\"), mdx(\"p\", null, \"The purpose of a redirect is to help someone get back on track and achieve their goals. There's respect and caring behind a redirect.\"), mdx(\"p\", null, \"Let the other person know what the facts of the mistake were and review it together. \", mdx(\"em\", {\n    parentName: \"p\"\n  }, \"Be very specific.\"), \" Then, walk the other person through how you \", mdx(\"em\", {\n    parentName: \"p\"\n  }, \"feel\"), \" about it and its possible impact on the team results.\"), mdx(\"p\", null, \"Give the other person a few moments of quiet time to think about it. Then, remind the other person that you feel they're better than one mistake, you have confidence and trust in them, and you don't expect a repeat.\"), mdx(\"blockquote\", null, mdx(\"p\", {\n    parentName: \"blockquote\"\n  }, \"Sometimes you have to care enough to be tough\\u2014that is, tough on the poor performance but not the person.\")), mdx(\"p\", null, \"By reaffirming your value of the person, it makes it easier to not react negatively to the redirect. You want to build confidence in others. When the redirect is over, it's over.\"), mdx(\"p\", null, \"Personally, I like two things about the redirect.\"), mdx(\"ul\", null, mdx(\"li\", {\n    parentName: \"ul\"\n  }, \"First, it implies a small change. It allows you to not feel authoritarian.\"), mdx(\"li\", {\n    parentName: \"ul\"\n  }, \"Second, it's a \", mdx(\"em\", {\n    parentName: \"li\"\n  }, \"service\"), \" to the other person. When done right, it can be appreciated.\")), mdx(\"h3\", null, \"Explanation\"), mdx(\"p\", null, \"Isn't the \\\"one-minute\\\" thing a little hokey? Can all feedback really be confined to one minute?\"), mdx(\"blockquote\", null, mdx(\"p\", {\n    parentName: \"blockquote\"\n  }, \"Of course not. But it's a way to make a complicated job more manageable.\")), mdx(\"p\", null, \"Feedback is the number one motivator of people. People shouldn't have to wait for their performance reviews to get it.\"), mdx(\"p\", null, \"Also, it's not effective to store up observations of poor behavior. When that happens, people usually end up disagreeing with the facts, or they stay quiet and become resentful.\"), mdx(\"p\", null, \"Punishment doesn't work when someone is learning. All it does is discourage them from stretching. Redirects allow us to change behavior without killing motivation.\"), mdx(\"blockquote\", null, mdx(\"p\", {\n    parentName: \"blockquote\"\n  }, \"If you are first tough on the behavior, and then supportive of the person, it works better.\")), mdx(\"blockquote\", null, mdx(\"p\", {\n    parentName: \"blockquote\"\n  }, \"When our self-concept is under attack, we feel a need to defend ourselves and our actions, even to the extent of distorting the facts.\")));\n}\n;\nMDXContent.isMDXComponent = true;"},"note":{"authors":["Ken Blanchard","Spencer Johnson"],"category":"Book","date":"2019-07-31","published":true,"slug":"one-minute-manager","source":"The New One Minute Manager","title":"The New One Minute Manager","url":"https://smile.amazon.com/New-One-Minute-Manager-ebook/dp/B00MMG19OG"}},"pageContext":{"id":"805b73c9-884e-5bb6-8380-38293abcd04d","slug":"one-minute-manager","__params":{"slug":"one-minute-manager"}}},
    "staticQueryHashes": []}