{
    "componentChunkName": "component---src-pages-notes-note-slug-jsx",
    "path": "/notes/the-idea-hunter/",
    "result": {"data":{"mdx":{"body":"var _excluded = [\"components\"];\n\nfunction _extends() { _extends = Object.assign || function (target) { for (var i = 1; i < arguments.length; i++) { var source = arguments[i]; for (var key in source) { if (Object.prototype.hasOwnProperty.call(source, key)) { target[key] = source[key]; } } } return target; }; return _extends.apply(this, arguments); }\n\nfunction _objectWithoutProperties(source, excluded) { if (source == null) return {}; var target = _objectWithoutPropertiesLoose(source, excluded); var key, i; if (Object.getOwnPropertySymbols) { var sourceSymbolKeys = Object.getOwnPropertySymbols(source); for (i = 0; i < sourceSymbolKeys.length; i++) { key = sourceSymbolKeys[i]; if (excluded.indexOf(key) >= 0) continue; if (!Object.prototype.propertyIsEnumerable.call(source, key)) continue; target[key] = source[key]; } } return target; }\n\nfunction _objectWithoutPropertiesLoose(source, excluded) { if (source == null) return {}; var target = {}; var sourceKeys = Object.keys(source); var key, i; for (i = 0; i < sourceKeys.length; i++) { key = sourceKeys[i]; if (excluded.indexOf(key) >= 0) continue; target[key] = source[key]; } return target; }\n\n/* @jsxRuntime classic */\n\n/* @jsx mdx */\nvar _frontmatter = {\n  \"title\": \"The Idea Hunter\",\n  \"Authors\": \"Andy Boynton\",\n  \"Published\": true,\n  \"Category\": {\n    \"id\": \"650097b4-ead7-4703-a1dd-15e1ee9c8d02\",\n    \"name\": \"Book\",\n    \"color\": \"default\"\n  },\n  \"Slug\": \"the-idea-hunter\",\n  \"Source\": \"Amazon\",\n  \"Date\": {\n    \"start\": \"2016-08-29T00:00:00.000Z\",\n    \"end\": null,\n    \"time_zone\": null\n  },\n  \"Type\": {\n    \"type\": \"string\",\n    \"string\": \"Note\"\n  },\n  \"URL\": \"https://www.amazon.com/Idea-Hunter-Find-Ideas-Happen/dp/0470767766\"\n};\nvar layoutProps = {\n  _frontmatter: _frontmatter\n};\nvar MDXLayout = \"wrapper\";\nreturn function MDXContent(_ref) {\n  var components = _ref.components,\n      props = _objectWithoutProperties(_ref, _excluded);\n\n  return mdx(MDXLayout, _extends({}, layoutProps, props, {\n    components: components,\n    mdxType: \"MDXLayout\"\n  }), mdx(\"h3\", null, \"Introduction\"), mdx(\"p\", null, \"Finding the right idea is all about being in the habit of looking for them.\"), mdx(\"blockquote\", null, mdx(\"p\", {\n    parentName: \"blockquote\"\n  }, \"Ideas aren\\u2019t generated so much as they\\u2019re found and then something useful is done with them.\")), mdx(\"h4\", null, \"I-D-E-A\"), mdx(\"ul\", null, mdx(\"li\", {\n    parentName: \"ul\"\n  }, mdx(\"strong\", {\n    parentName: \"li\"\n  }, \"Interested:\"), \" Do I want to be \", mdx(\"em\", {\n    parentName: \"li\"\n  }, \"interested\"), \" or merely \", mdx(\"em\", {\n    parentName: \"li\"\n  }, \"interesting\"), \"? \", mdx(\"em\", {\n    parentName: \"li\"\n  }, \"\\u201CCuriosity will take you further toward your goals than cleverness or even brilliance.\\u201D\")), mdx(\"li\", {\n    parentName: \"ul\"\n  }, mdx(\"strong\", {\n    parentName: \"li\"\n  }, \"Diverse:\"), \" Finding the right idea is about combining a collection of \", mdx(\"em\", {\n    parentName: \"li\"\n  }, \"diverse\"), \" idea sources. \", mdx(\"em\", {\n    parentName: \"li\"\n  }, \"\\u201CThis is how to avoid the plague of \\u2018me too\\u2019 ideas that come from traveling the same narrow paths as everyone else if your group or field. You don\\u2019t want to be where the competition is\\u2014browsing the same publications, going to the same web sites, comparing notes with the same people, and winding up with variations (at best) of the same tried ideas. You want to bring in thoughts that are different but applicable, seemingly unrelated but potentially valuable-whiter the source is a member of your team at work or the guy who coaches your daughter\\u2019s softball team.\\u201D\")), mdx(\"li\", {\n    parentName: \"ul\"\n  }, mdx(\"strong\", {\n    parentName: \"li\"\n  }, \"Exercised:\"), \" You need to \", mdx(\"em\", {\n    parentName: \"li\"\n  }, \"exercise\"), \" your idea muscles all the time, not just when brainstorming at work.\"), mdx(\"li\", {\n    parentName: \"ul\"\n  }, mdx(\"strong\", {\n    parentName: \"li\"\n  }, \"Agile:\"), \" You need to be \", mdx(\"em\", {\n    parentName: \"li\"\n  }, \"agile\"), \" in your handling of ideas. You can\\u2019t glob on to an idea, or you block all the other ideas you could have. \", mdx(\"em\", {\n    parentName: \"li\"\n  }, \"\\u201CWild ideas are encouraged, bad ideas are not a deal breaker, and quantity is preferred over quality.\\u201D\"))), mdx(\"h3\", null, \"Know Your Gig\"), mdx(\"p\", null, \"They\\u2019re talking about your gig in life. It\\u2019s that fundamental thing that you do. It\\u2019s the essence of the problem you\\u2019re solving, not the specific solution. Think about Marcus Lemonis from The Profit. His gig is stepping into failing business, fixing the broken parts and then making money off of them.\"), mdx(\"p\", null, mdx(\"em\", {\n    parentName: \"p\"\n  }, \"Gigs give focus and direction to learning and idea seeking.\")), mdx(\"p\", null, \"Once you have a gig, you can keep doing that thing at larger and larger scales.\"), mdx(\"h4\", null, \"The Discernment\"), mdx(\"p\", null, \"Questions to help you discern your gig:\"), mdx(\"h4\", null, \"Tom Peters\"), mdx(\"ul\", null, mdx(\"li\", {\n    parentName: \"ul\"\n  }, \"What do I want to be?\"), mdx(\"li\", {\n    parentName: \"ul\"\n  }, \"What do I want to stand for?\"), mdx(\"li\", {\n    parentName: \"ul\"\n  }, \"Does my work matter?\"), mdx(\"li\", {\n    parentName: \"ul\"\n  }, \"Am I making a difference?\"), mdx(\"li\", {\n    parentName: \"ul\"\n  }, \"Who are you?\"), mdx(\"li\", {\n    parentName: \"ul\"\n  }, \"What is your product?\"), mdx(\"li\", {\n    parentName: \"ul\"\n  }, \"How is it special?\"), mdx(\"li\", {\n    parentName: \"ul\"\n  }, \"How is it different from other such offerings?\"), mdx(\"li\", {\n    parentName: \"ul\"\n  }, \"How can I demonstrate its trustworthiness?\"), mdx(\"li\", {\n    parentName: \"ul\"\n  }, \"How can I demonstrate I\\u2019m \\u201Cwith it/contemporary?\\u201D\")), mdx(\"h4\", null, \"Michael Himes\"), mdx(\"ul\", null, mdx(\"li\", {\n    parentName: \"ul\"\n  }, mdx(\"p\", {\n    parentName: \"li\"\n  }, \"Is this a source of joy?\")), mdx(\"li\", {\n    parentName: \"ul\"\n  }, mdx(\"p\", {\n    parentName: \"li\"\n  }, \"Is this something that taps into your talents and gifts\\u2014engages all of your abilities\\u2014and uses them in the fullest way possible?\")), mdx(\"li\", {\n    parentName: \"ul\"\n  }, mdx(\"p\", {\n    parentName: \"li\"\n  }, \"Is this role a genuine service to the people around you, to society at large?\")), mdx(\"li\", {\n    parentName: \"ul\"\n  }, mdx(\"p\", {\n    parentName: \"li\"\n  }, \"Do you get a kick out of it?\")), mdx(\"li\", {\n    parentName: \"ul\"\n  }, mdx(\"p\", {\n    parentName: \"li\"\n  }, \"Are you any good at it?\")), mdx(\"li\", {\n    parentName: \"ul\"\n  }, mdx(\"p\", {\n    parentName: \"li\"\n  }, \"Does anyone want you to do it?\\nReworded:\")), mdx(\"li\", {\n    parentName: \"ul\"\n  }, mdx(\"p\", {\n    parentName: \"li\"\n  }, \"What is it that constantly grabs my interest and sparks my curiosity?\")), mdx(\"li\", {\n    parentName: \"ul\"\n  }, mdx(\"p\", {\n    parentName: \"li\"\n  }, \"What am I good at? And what do I want to be great at?\")), mdx(\"li\", {\n    parentName: \"ul\"\n  }, mdx(\"p\", {\n    parentName: \"li\"\n  }, \"And where\\u2019s the market for this?\\nAnswering these questions isn\\u2019t about reinventing yourself, it\\u2019s about reflecting on what you\\u2019re already doing.\"))), mdx(\"p\", null, \"A gig is not static. You\\u2019ll need to continuously self-reflect and revise.\"), mdx(\"h4\", null, \"The Circle of Competence\"), mdx(\"p\", null, \"Stay within the area that you know well and you excel at.\"), mdx(\"blockquote\", null, mdx(\"p\", {\n    parentName: \"blockquote\"\n  }, \"\\u2026Ted Williams, the famed Red Sox slugger who revealed the secret to his success in his book The Science of Hitting. Nicknamed the \\u2018Splendid Splinter,\\u2019 his approach was to carve the strike zone into seventy-seven cells, each one the size of a baseball. We swung at the balls that landed in his best cells, and let the other whizz by, even if it meant being called out on strikes once in a while.\\nWith this approach, humility is a useful and valuable skill. When you don\\u2019t know something, humility can save you from burning resources on it.\")), mdx(\"p\", null, \"The authors believe the emphasis should be on widening the circle through constant learning and deep interest in matters related to your gig (or your next gig).\"), mdx(\"h4\", null, \"Gigs Matter\"), mdx(\"blockquote\", null, mdx(\"p\", {\n    parentName: \"blockquote\"\n  }, \"The gig is a general filter. It screens out some of the information and ideas that cascade your way, making it easier to repel the demons of information overload.\\nA person can have more than one gig. There are entire categories of gigs, such as creating new things or improving existing things.\")), mdx(\"p\", null, \"Be Interested, Not Just Interesting\"), mdx(\"blockquote\", null, mdx(\"p\", {\n    parentName: \"blockquote\"\n  }, \"Something happens to a curious, fully engaged mind. Strange little sparks are set off, connections made, insights triggered. The results: an exponentially increased ability to tune up/reinvent/wow-ize today\\u2019s project at work. \\u2014Tom Peters\\nInterest gives rise to learning, and learning leads to ideas.\")), mdx(\"blockquote\", null, mdx(\"p\", {\n    parentName: \"blockquote\"\n  }, \"One of the most reliable ways of coming up with ideas is to make sure the people around us are coming up with ideas. Lots of them.\\nI should be carving out time every day for learning. Reading and conversations are the basic building blocks. Dabble time is not wasted time.\")), mdx(\"h3\", null, \"Diversifying the Hunt\"), mdx(\"blockquote\", null, mdx(\"p\", {\n    parentName: \"blockquote\"\n  }, \"My sense was that once I started looking for business ideas, they were everywhere. It\\u2019s sort of like a radio frequency. You\\u2019re surrounded by radio waves, but if you\\u2019re not tuning into them, you\\u2019re not going to receive them. \\u2014Jim Koch\\nIf you want to find ideas, you have to travel down lots of paths. You have to be different in some positive way.\")), mdx(\"blockquote\", null, mdx(\"p\", {\n    parentName: \"blockquote\"\n  }, \"The most valuable information comes from outside a person\\u2019s usual network of contacts, through weak ties.\\nI shouldn\\u2019t be trying to come up with thoroughly original ideas all the time. Instead, I should be searching for existing ideas that could be reworked into new ones. That\\u2019s how most innovation is done. It\\u2019s not the same as original thinking.\")), mdx(\"h3\", null, \"Mastering the Habits of the Hunt\"), mdx(\"p\", null, \"You have to spend time mentally working out your idea muscles.\"), mdx(\"blockquote\", null, mdx(\"p\", {\n    parentName: \"blockquote\"\n  }, \"Accomplished people don\\u2019t bulk up their brains with intellectual calisthenics; the immerse themselves in their fields. Novelists read lost of novels, scientists read lots of science.\\u201D \\u2014Steven Pinker\\nLike Sam Walton, go shopping in other peoples\\u2019 stores.\")), mdx(\"p\", null, \"We learn by doing. We also learn by reflecting on what we\\u2019ve been doing.\"), mdx(\"blockquote\", null, mdx(\"p\", {\n    parentName: \"blockquote\"\n  }, \"Chance favors the prepared mind.\\u201D \\u2014tLouis Pasteur\\nWhen having conversations, ask questions with the intent of finding new ideas. And engage with customers and clients. Try to set a goal of learning three new things about your customers each week.\")), mdx(\"p\", null, \"It\\u2019s important to write down ideas. The process of writing helps to crystalize and clarify them.\"), mdx(\"p\", null, \"Observation can be greatly enhanced by \", mdx(\"em\", {\n    parentName: \"p\"\n  }, \"prototyping\"), \". Try to get one out as early as possible in the process.\"), mdx(\"h4\", null, \"Idea Flow Is Critical\"), mdx(\"p\", null, \"The goal isn\\u2019t to have a lightbulb moment. The goal is to set an idea in motion, let is percolate and the result will evolve naturally. \", mdx(\"em\", {\n    parentName: \"p\"\n  }, \"Idea flow\"), \" is critical because ideas take time to develop, and you can\\u2019t stop them in their tracks before they get the chance.\"), mdx(\"p\", null, \"It\\u2019s important to capture ideas as they appear. \", mdx(\"em\", {\n    parentName: \"p\"\n  }, \"Write them down\"), \".\"), mdx(\"p\", null, \"The more ideas, the better. Go for quantity over quality. You can always filter them out later. Our desire to make sure our work is \\u201Cgood\\u201D gets in the way of good ideas.\"), mdx(\"p\", null, \"Your idea has to be compatible with the world around it. Try to structure the idea in such as way that it forces as little change as possible.\"), mdx(\"p\", null, \"Aim for \\u201Chot button\\u201D ideas. What keeps people up at night? What are their fondest dreams and worst nightmares?\"), mdx(\"h4\", null, \"Create Great Conversations\"), mdx(\"ul\", null, mdx(\"li\", {\n    parentName: \"ul\"\n  }, \"To have successful conversations, you must send the right signals. Try to use \", mdx(\"em\", {\n    parentName: \"li\"\n  }, \"continuers\"), \" rather than \", mdx(\"em\", {\n    parentName: \"li\"\n  }, \"terminators.\"), \" \\u201CContinuers invite honest discussion; the build ideas. Terminators pour cold water on conversations; they kill off ideas.\\u201D\"), mdx(\"li\", {\n    parentName: \"ul\"\n  }, \"All ideas should be welcomed. That\\u2019s not to say every idea should be acted upon, but it\\u2019s important to keep the flow moving.\"), mdx(\"li\", {\n    parentName: \"ul\"\n  }, \"Have a stupid stick. A stupid stick lets the holder say anything that comes to mind without any ridicule. Every idea meeting needs a stupid stick.\"), mdx(\"li\", {\n    parentName: \"ul\"\n  }, \"Ask opened-ended questions. They should flow out of genuine interest and curiosity. Great questions will surprise people.\"), mdx(\"li\", {\n    parentName: \"ul\"\n  }, mdx(\"em\", {\n    parentName: \"li\"\n  }, \"\\u201CNever underestimate the value of what might be called a \\u2018niece expert.\\u2019 This is someone who asks the right questions not \", mdx(\"strong\", {\n    parentName: \"em\"\n  }, \"despite\"), \" his or her lack of formal expertise and experience but \", mdx(\"strong\", {\n    parentName: \"em\"\n  }, \"because\"), \" of it.\\u201D\")), mdx(\"li\", {\n    parentName: \"ul\"\n  }, \"When you\\u2019re thinking about terminating a conversation, ask yourself: \\u201CWhat if he/she is right?\\u201D\")));\n}\n;\nMDXContent.isMDXComponent = true;"},"note":{"authors":["Andy Boynton"],"category":"Book","date":"2016-08-29","published":true,"slug":"the-idea-hunter","source":"Amazon","title":"The Idea Hunter","url":"https://www.amazon.com/Idea-Hunter-Find-Ideas-Happen/dp/0470767766"}},"pageContext":{"id":"c72a3be6-9df7-5ca5-9f63-d21990ef70ac","slug":"the-idea-hunter","__params":{"slug":"the-idea-hunter"}}},
    "staticQueryHashes": []}