{
    "componentChunkName": "component---src-pages-notes-note-slug-jsx",
    "path": "/notes/personal-mba/",
    "result": {"data":{"mdx":{"body":"var _excluded = [\"components\"];\n\nfunction _extends() { _extends = Object.assign || function (target) { for (var i = 1; i < arguments.length; i++) { var source = arguments[i]; for (var key in source) { if (Object.prototype.hasOwnProperty.call(source, key)) { target[key] = source[key]; } } } return target; }; return _extends.apply(this, arguments); }\n\nfunction _objectWithoutProperties(source, excluded) { if (source == null) return {}; var target = _objectWithoutPropertiesLoose(source, excluded); var key, i; if (Object.getOwnPropertySymbols) { var sourceSymbolKeys = Object.getOwnPropertySymbols(source); for (i = 0; i < sourceSymbolKeys.length; i++) { key = sourceSymbolKeys[i]; if (excluded.indexOf(key) >= 0) continue; if (!Object.prototype.propertyIsEnumerable.call(source, key)) continue; target[key] = source[key]; } } return target; }\n\nfunction _objectWithoutPropertiesLoose(source, excluded) { if (source == null) return {}; var target = {}; var sourceKeys = Object.keys(source); var key, i; for (i = 0; i < sourceKeys.length; i++) { key = sourceKeys[i]; if (excluded.indexOf(key) >= 0) continue; target[key] = source[key]; } return target; }\n\n/* @jsxRuntime classic */\n\n/* @jsx mdx */\nvar _frontmatter = {\n  \"title\": \"The Personal MBA\",\n  \"Authors\": \"Josh Kaufman\",\n  \"Published\": true,\n  \"Media\": {\n    \"id\": \"650097b4-ead7-4703-a1dd-15e1ee9c8d02\",\n    \"name\": \"Book\",\n    \"color\": \"default\"\n  },\n  \"Slug\": \"personal-mba\",\n  \"Source\": \"The Personal MBA\",\n  \"Date\": {\n    \"start\": \"2018-04-18T00:00:00.000Z\",\n    \"end\": null,\n    \"time_zone\": null\n  },\n  \"Category\": {\n    \"id\": \"f60b7960-389a-42f6-995a-2575d34f2e2a\",\n    \"name\": \"Business\",\n    \"color\": \"default\"\n  },\n  \"Type\": {\n    \"type\": \"string\",\n    \"string\": \"Note\"\n  },\n  \"URL\": \"https://smile.amazon.com/Personal-MBA-Master-Art-Business/dp/1591845572?sa-no-redirect=1\"\n};\nvar layoutProps = {\n  _frontmatter: _frontmatter\n};\nvar MDXLayout = \"wrapper\";\nreturn function MDXContent(_ref) {\n  var components = _ref.components,\n      props = _objectWithoutProperties(_ref, _excluded);\n\n  return mdx(MDXLayout, _extends({}, layoutProps, props, {\n    components: components,\n    mdxType: \"MDXLayout\"\n  }), mdx(\"h3\", null, \"Introduction\"), mdx(\"blockquote\", null, mdx(\"p\", {\n    parentName: \"blockquote\"\n  }, \"Skip business school. Educate yourself.\")), mdx(\"p\", null, \"MBA programs have three major systemic issues:\"), mdx(\"ul\", null, mdx(\"li\", {\n    parentName: \"ul\"\n  }, \"\\u201CMBA programs have become so expensive that you must effectively mortgage your life to pay the price of admission.\\u201D\"), mdx(\"li\", {\n    parentName: \"ul\"\n  }, \"\\u201CMBA programs teach many worthless, outdated or even outright damaging concepts and principles.\\u201D\"), mdx(\"li\", {\n    parentName: \"ul\"\n  }, \"\\u201CMBA programs won\\u2019t guarantee you a high-paying job, let alone make you a skilled manager or leader with a shot at the executive suite.\\u201D\")), mdx(\"h3\", null, \"Value Creation\"), mdx(\"h4\", null, \"The Five Parts of Every Business\"), mdx(\"p\", null, \"Roughly defined, a business is a reliably repeatable process that:\"), mdx(\"ol\", null, mdx(\"li\", {\n    parentName: \"ol\"\n  }, mdx(\"strong\", {\n    parentName: \"li\"\n  }, \"Value creation:\"), \" Create and deliver something of value\"), mdx(\"li\", {\n    parentName: \"ol\"\n  }, mdx(\"strong\", {\n    parentName: \"li\"\n  }, \"Customer demand:\"), \" Other people must want or need it\"), mdx(\"li\", {\n    parentName: \"ol\"\n  }, mdx(\"strong\", {\n    parentName: \"li\"\n  }, \"Transactions:\"), \" People must be willing and able to pay for it.\"), mdx(\"li\", {\n    parentName: \"ol\"\n  }, mdx(\"strong\", {\n    parentName: \"li\"\n  }, \"Value delivery:\"), \" It must satisfy the purchaser\\u2019s needs and expectations\"), mdx(\"li\", {\n    parentName: \"ol\"\n  }, mdx(\"strong\", {\n    parentName: \"li\"\n  }, \"Profit sufficiency:\"), \" It must provide the owners a way to make a profit sufficient to justify the continued operation.\")), mdx(\"p\", null, \"These correspond to five business processes:\"), mdx(\"ol\", null, mdx(\"li\", {\n    parentName: \"ol\"\n  }, mdx(\"strong\", {\n    parentName: \"li\"\n  }, \"Value creation:\"), \" Discovering what people need or want, and then creating it.\"), mdx(\"li\", {\n    parentName: \"ol\"\n  }, mdx(\"strong\", {\n    parentName: \"li\"\n  }, \"Marketing:\"), \" Attracting attention and building demand for what you\\u2019ve created.\"), mdx(\"li\", {\n    parentName: \"ol\"\n  }, mdx(\"strong\", {\n    parentName: \"li\"\n  }, \"Sales:\"), \" Turning prospective customers into paying customers.\"), mdx(\"li\", {\n    parentName: \"ol\"\n  }, mdx(\"strong\", {\n    parentName: \"li\"\n  }, \"Value delivery:\"), \" Giving your customers what you\\u2019ve promised and ensuring they\\u2019re satisfied.\"), mdx(\"li\", {\n    parentName: \"ol\"\n  }, mdx(\"strong\", {\n    parentName: \"li\"\n  }, \"Finance:\"), \" Bringing in enough money to keep your effort going and make your effort worthwhile.\")), mdx(\"blockquote\", null, mdx(\"p\", {\n    parentName: \"blockquote\"\n  }, \"If you can clearly define each of these five processes for any business, you have a complete understanding of how it works.\")), mdx(\"h4\", null, \"The Iron Law of the Market\"), mdx(\"p\", null, mdx(\"strong\", {\n    parentName: \"p\"\n  }, \"The Iron Law of the Market:\"), \" If you don\\u2019t have a large group of people who really want what you offer, your chances of building a viable business are really slim.\"), mdx(\"blockquote\", null, mdx(\"p\", {\n    parentName: \"blockquote\"\n  }, \"The best approach is to focus on making things people want to buy.\")), mdx(\"h4\", null, \"Core Human Drives\"), mdx(\"p\", null, mdx(\"strong\", {\n    parentName: \"p\"\n  }, \"ERG Theory:\"), \" People seek existence, relatedness and growth in that order.\"), mdx(\"p\", null, \"This explains the priority of human desires, but not the methods. All human beings have core human drives that have a profound influence on our decisions and actions:\"), mdx(\"ul\", null, mdx(\"li\", {\n    parentName: \"ul\"\n  }, mdx(\"strong\", {\n    parentName: \"li\"\n  }, \"Desire to acquire:\"), \" Obtaining and collecting physical objects, as well as immaterial qualities like status, power and influence.\"), mdx(\"li\", {\n    parentName: \"ul\"\n  }, mdx(\"strong\", {\n    parentName: \"li\"\n  }, \"Desire to bond:\"), \" The desire to feel valued and loved by forming relationships with others, either platonic or romantic.\"), mdx(\"li\", {\n    parentName: \"ul\"\n  }, mdx(\"strong\", {\n    parentName: \"li\"\n  }, \"Desire to learn:\"), \" The desire to satisfy our curiosity.\"), mdx(\"li\", {\n    parentName: \"ul\"\n  }, mdx(\"strong\", {\n    parentName: \"li\"\n  }, \"Desire to defend:\"), \" The desire to protect ourselves, our loved ones and our property.\"), mdx(\"li\", {\n    parentName: \"ul\"\n  }, mdx(\"strong\", {\n    parentName: \"li\"\n  }, \"Desire to feel:\"), \" The desire for new sensory stimulus, intense emotional experiences, pleasure, excitement, entertainment and anticipation.\")), mdx(\"blockquote\", null, mdx(\"p\", {\n    parentName: \"blockquote\"\n  }, \"Whenever a group of people has an unmet need in one or more of these areas, a market will form to satisfy that need.\")), mdx(\"h4\", null, \"Status Seeking\"), mdx(\"p\", null, \"Human beings seek status. We care what other people think of us, and we spend an inordinate amount of time tracking our relative status compared to other members of our groups.\"), mdx(\"blockquote\", null, mdx(\"p\", {\n    parentName: \"blockquote\"\n  }, \"When given a choice between different alternatives, people will typically choose the option with the highest perceived status.\")), mdx(\"h4\", null, \"Ten Ways to Evaluate a Market\"), mdx(\"p\", null, \"This is a back-of-the-napkin approach for identifying the attractiveness of a market. Rate each factor below on a scale of 0 to 10. When in doubt, be conservative.\"), mdx(\"ul\", null, mdx(\"li\", {\n    parentName: \"ul\"\n  }, mdx(\"strong\", {\n    parentName: \"li\"\n  }, \"Urgency:\"), \" How bad do people need or want this right now?\"), mdx(\"li\", {\n    parentName: \"ul\"\n  }, mdx(\"strong\", {\n    parentName: \"li\"\n  }, \"Market size:\"), \" How many people are actively purchasing things like this?\"), mdx(\"li\", {\n    parentName: \"ul\"\n  }, mdx(\"strong\", {\n    parentName: \"li\"\n  }, \"Pricing potential:\"), \" What\\u2019s the highest price a typical purchaser would be willing to spend for a solution?\"), mdx(\"li\", {\n    parentName: \"ul\"\n  }, mdx(\"strong\", {\n    parentName: \"li\"\n  }, \"Cost of customer acquisition:\"), \" How easy is it to acquire a new customer? On average, how much will it cost to generate a new sale, in both time and effort?\"), mdx(\"li\", {\n    parentName: \"ul\"\n  }, mdx(\"strong\", {\n    parentName: \"li\"\n  }, \"Cost of value delivery:\"), \" How much would it cost to create and deliver the value offered, both in money and effort?\"), mdx(\"li\", {\n    parentName: \"ul\"\n  }, mdx(\"strong\", {\n    parentName: \"li\"\n  }, \"Uniqueness of offer:\"), \" How unique is your offer versus competing offers in the market, and how easy is it for potential competitors to copy you?\"), mdx(\"li\", {\n    parentName: \"ul\"\n  }, mdx(\"strong\", {\n    parentName: \"li\"\n  }, \"Speed to market:\"), \" How quickly can you create something to sell?\"), mdx(\"li\", {\n    parentName: \"ul\"\n  }, mdx(\"strong\", {\n    parentName: \"li\"\n  }, \"Up-front investment:\"), \" How much will you have to invest before you\\u2019re ready to sell?\"), mdx(\"li\", {\n    parentName: \"ul\"\n  }, mdx(\"strong\", {\n    parentName: \"li\"\n  }, \"Upsell potential:\"), \" Are there related secondary offerings you could present to customers?\"), mdx(\"li\", {\n    parentName: \"ul\"\n  }, mdx(\"strong\", {\n    parentName: \"li\"\n  }, \"Evergreen potential:\"), \" Once the initial offer is created, how much additional work would you have to put in to continue to sell.\")), mdx(\"p\", null, \"If the final score is above 75, you have a very promising market. Anything between 50 and 75 will pay the bills, but probably won\\u2019t be a home run.\"), mdx(\"h4\", null, \"The Hidden Benefits of Competition\"), mdx(\"blockquote\", null, mdx(\"p\", {\n    parentName: \"blockquote\"\n  }, \"When any two markets are equally attractive, you\\u2019re better off choosing to enter the one with competition.  Here\\u2019s why: it means you know from the start there\\u2019s a market of paying customers for this idea, eliminating your biggest risk.\")), mdx(\"h4\", null, \"Twelve Standard Forms of Value (Expanded)\"), mdx(\"ol\", null, mdx(\"li\", {\n    parentName: \"ol\"\n  }, mdx(\"strong\", {\n    parentName: \"li\"\n  }, \"Product:\"), \" Create a single tangible item or entity, then sell and deliver it for more than what it cost to make. Products are valuable because they can be \", mdx(\"em\", {\n    parentName: \"li\"\n  }, \"duplicated\"), \".\"), mdx(\"li\", {\n    parentName: \"ol\"\n  }, mdx(\"strong\", {\n    parentName: \"li\"\n  }, \"Service:\"), \" Provide help or assistance, then charge a fee for the benefits rendered. Services depend on the owner's investment in time and energy, both of which are finite. Because of this, services do not scale easily.\"), mdx(\"li\", {\n    parentName: \"ol\"\n  }, mdx(\"strong\", {\n    parentName: \"li\"\n  }, \"Shared Resource:\"), \" Create durable assets that can be used by many people, then charge for access.\"), mdx(\"li\", {\n    parentName: \"ol\"\n  }, mdx(\"strong\", {\n    parentName: \"li\"\n  }, \"Subscription:\"), \" Offer a benefit on an ongoing basis, and in charge a recurring fee.\"), mdx(\"li\", {\n    parentName: \"ol\"\n  }, mdx(\"strong\", {\n    parentName: \"li\"\n  }, \"Resale:\"), \" Acquire an asset, then allow another person to use that asset for a predefined amount of time in exchange for a fee.\"), mdx(\"li\", {\n    parentName: \"ol\"\n  }, mdx(\"strong\", {\n    parentName: \"li\"\n  }, \"Lease:\"), \" Acquire an asset, then allow another person to use that asset for a predefined amount of time in exchange for a fee.\"), mdx(\"li\", {\n    parentName: \"ol\"\n  }, mdx(\"strong\", {\n    parentName: \"li\"\n  }, \"Agency:\"), \" Market and sell an asset or service that you don\\u2019t own on behalf of a third party, then collect a percentage of the transaction price as a fee.\"), mdx(\"li\", {\n    parentName: \"ol\"\n  }, mdx(\"strong\", {\n    parentName: \"li\"\n  }, \"Audience Aggregation:\"), \" Get the attention of a group of people with certain characteristics, then sell access in the form of advertising to another business looking to reach that audience.\"), mdx(\"li\", {\n    parentName: \"ol\"\n  }, mdx(\"strong\", {\n    parentName: \"li\"\n  }, \"Loan:\"), \" Lend a certain amount of money, then collect payments over a predefined period of time equal to the original loan plus a predefined interest rate.\"), mdx(\"li\", {\n    parentName: \"ol\"\n  }, mdx(\"strong\", {\n    parentName: \"li\"\n  }, \"Option:\"), \" Offer the ability to take a predefined action for a fixed period of time in exchange for a fee.\"), mdx(\"li\", {\n    parentName: \"ol\"\n  }, mdx(\"strong\", {\n    parentName: \"li\"\n  }, \"Insurance:\"), \" Take on the risk of some specific bad thing happening to the policyholder in exchange for a predefined series of payments, then pay out claims only when the bad thing actually happens.\"), mdx(\"li\", {\n    parentName: \"ol\"\n  }, mdx(\"strong\", {\n    parentName: \"li\"\n  }, \"Capital:\"), \" Purchase an ownership stake in a business, then collect a corresponding portion of the profit as a one-time payout or ongoing dividend.\")), mdx(\"ul\", null, mdx(\"li\", {\n    parentName: \"ul\"\n  }, \"Products are valuable because they can be \", mdx(\"em\", {\n    parentName: \"li\"\n  }, \"duplicated\"), \".\"), mdx(\"li\", {\n    parentName: \"ul\"\n  }, \"Services depend on the service provider\\u2019s investment of time and energy, which are finite resources.\"), mdx(\"li\", {\n    parentName: \"ul\"\n  }, \"Subscriptions are attractive because they provide predictable revenue. You can build a steady base of customers over time instead of having to constantly resell your product.\"), mdx(\"li\", {\n    parentName: \"ul\"\n  }, \"To successfully provide value via leases, you must ensure the revenue from the lease covers the purchase price of the asset before it wears out or is lost.\"), mdx(\"li\", {\n    parentName: \"ul\"\n  }, \"Sellers benefit from an agency because it generates sales that might not otherwise have happened.\"), mdx(\"li\", {\n    parentName: \"ul\"\n  }, \"The process of \", mdx(\"em\", {\n    parentName: \"li\"\n  }, \"underwriting\"), \", or predicting how risky a loan is, is critically important to lenders.\"), mdx(\"li\", {\n    parentName: \"ul\"\n  }, \"Options are valuable because they \", mdx(\"em\", {\n    parentName: \"li\"\n  }, \"allow\"), \" a person to perform an action without \", mdx(\"em\", {\n    parentName: \"li\"\n  }, \"requiring\"), \" them to do so.\"), mdx(\"li\", {\n    parentName: \"ul\"\n  }, \"Instance works because it spreads the risk over a large number of individuals. As long as the insurer brings in more payments than it pays in claims, the insurer makes money.\")), mdx(\"h4\", null, \"Hassle Premium\"), mdx(\"blockquote\", null, mdx(\"p\", {\n    parentName: \"blockquote\"\n  }, \"People are almost always willing to pay for things they believe are too much of a pain to take care of themselves. Where there\\u2019s a hassle, there\\u2019s a business opportunity.\")), mdx(\"p\", null, \"Some examples of hassle:\"), mdx(\"ul\", null, mdx(\"li\", {\n    parentName: \"ul\"\n  }, \"Takes too much time.\"), mdx(\"li\", {\n    parentName: \"ul\"\n  }, \"Requires too much effort.\"), mdx(\"li\", {\n    parentName: \"ul\"\n  }, \"Distracts from other priorities.\"), mdx(\"li\", {\n    parentName: \"ul\"\n  }, \"Involves too much confusion, uncertainty, or complexity.\"), mdx(\"li\", {\n    parentName: \"ul\"\n  }, \"Requires experience or specialization.\"), mdx(\"li\", {\n    parentName: \"ul\"\n  }, \"Requires resources or equipment.\")), mdx(\"h4\", null, \"Perceived Value\"), mdx(\"blockquote\", null, mdx(\"p\", {\n    parentName: \"blockquote\"\n  }, \"Perceived value determines how much your customers will be willing to pay for what you\\u2019re offering. The more valuable a prospect believes your offer is, the more likely they\\u2019ll be to buy it, and the more they\\u2019ll be willing to pay.\")), mdx(\"p\", null, \"Nothing matters except \", mdx(\"em\", {\n    parentName: \"p\"\n  }, \"perception\"), \". The converse of the above statement is also true. (If your customers do not perceive value, they are unlikely to pay for what you\\u2019re offering.)\"), mdx(\"h4\", null, \"Prototype\"), mdx(\"blockquote\", null, mdx(\"p\", {\n    parentName: \"blockquote\"\n  }, \"On their own, ideas are largely worthless\\u2014discovering whether or not you can actually make them work in reality is the most important job of any entrepreneur.\")), mdx(\"blockquote\", null, mdx(\"p\", {\n    parentName: \"blockquote\"\n  }, \"\\u201CStealth\\u201D mode diminishes any learning opportunities, putting you at a huge early disadvantage. It\\u2019s almost always better to focus on getting early feedback from real customers as quickly as you possibly can.\")), mdx(\"blockquote\", null, mdx(\"p\", {\n    parentName: \"blockquote\"\n  }, \"Prototypes are valuable because they allow you to get good feedback from real people without investing a huge amount of time, money and effort into the project.\")), mdx(\"h4\", null, \"The Iteration Cycle\"), mdx(\"blockquote\", null, mdx(\"p\", {\n    parentName: \"blockquote\"\n  }, \"Nobody\\u2014no matter how smart or talented\\u2014gets it right the first time.\")), mdx(\"p\", null, \"The WIGWAM method:\"), mdx(\"ul\", null, mdx(\"li\", {\n    parentName: \"ul\"\n  }, mdx(\"strong\", {\n    parentName: \"li\"\n  }, \"Watch:\"), \" What\\u2019s happening? What\\u2019s working and what\\u2019s not?\"), mdx(\"li\", {\n    parentName: \"ul\"\n  }, mdx(\"strong\", {\n    parentName: \"li\"\n  }, \"Ideate:\"), \" What could you improve? What are your options?\"), mdx(\"li\", {\n    parentName: \"ul\"\n  }, mdx(\"strong\", {\n    parentName: \"li\"\n  }, \"Guess:\"), \" Based on what you\\u2019ve learned so far, which of your ideas do you think will make the biggest impact?\"), mdx(\"li\", {\n    parentName: \"ul\"\n  }, mdx(\"strong\", {\n    parentName: \"li\"\n  }, \"Which?:\"), \" Decide what change to make.\"), mdx(\"li\", {\n    parentName: \"ul\"\n  }, mdx(\"strong\", {\n    parentName: \"li\"\n  }, \"Act:\"), \" Actually make the change.\"), mdx(\"li\", {\n    parentName: \"ul\"\n  }, mdx(\"strong\", {\n    parentName: \"li\"\n  }, \"Measure:\"), \" What happened? Was the change positive or negative? Should you make the change, or go back to how things were before this iteration?\")), mdx(\"p\", null, \"This feels like a lot of extra work because it \", mdx(\"em\", {\n    parentName: \"p\"\n  }, \"is\"), \" a lot of extra work. However, if an idea is a dud, it\\u2019s better to find out quickly and inexpensively.\"), mdx(\"h4\", null, \"Feedback\"), mdx(\"blockquote\", null, mdx(\"p\", {\n    parentName: \"blockquote\"\n  }, \"Useful feedback from real prospects helps you understand how well your offer meets their needs before development is complete, which allows you to make changes before you start selling.\"), mdx(\"ul\", {\n    parentName: \"blockquote\"\n  }, mdx(\"li\", {\n    parentName: \"ul\"\n  }, \"Get feedback from real customers, not friends and family.\"), mdx(\"li\", {\n    parentName: \"ul\"\n  }, \"Listen more than you talk.\"), mdx(\"li\", {\n    parentName: \"ul\"\n  }, \"Keep calm. This process requires thick skin.\"), mdx(\"li\", {\n    parentName: \"ul\"\n  }, \"The worse response you can get isn\\u2019t dislike, it\\u2019s apathy. If no one cares, you don\\u2019t have a viable business idea.\"), mdx(\"li\", {\n    parentName: \"ul\"\n  }, \"Give potential customers the opportunity to preorder. Are people willing to put their money where their mouse is?\"))), mdx(\"p\", null, \"If no one is willing to preorder, then you have more work to do. \", mdx(\"em\", {\n    parentName: \"p\"\n  }, \"Ask why they\\u2019re not willing to purchase.\")), mdx(\"h4\", null, \"Trade-Offs\"), mdx(\"blockquote\", null, mdx(\"p\", {\n    parentName: \"blockquote\"\n  }, \"A trade-off is a decision that places a higher value on one of several competing offers.\")), mdx(\"h4\", null, \"Economic Value\"), mdx(\"blockquote\", null, mdx(\"p\", {\n    parentName: \"blockquote\"\n  }, \"Every time your customers purchase from you, they\\u2019re deciding that they value what you have to offer more than they value anything else their money could buy at that moment.\")), mdx(\"p\", null, \"There are nine types of common economic value that people typically consider when evaluating a potential purchase:\"), mdx(\"ul\", null, mdx(\"li\", {\n    parentName: \"ul\"\n  }, mdx(\"strong\", {\n    parentName: \"li\"\n  }, \"Efficacy:\"), \" How well does it work?\"), mdx(\"li\", {\n    parentName: \"ul\"\n  }, mdx(\"strong\", {\n    parentName: \"li\"\n  }, \"Speed:\"), \" How quickly does it work?\"), mdx(\"li\", {\n    parentName: \"ul\"\n  }, mdx(\"strong\", {\n    parentName: \"li\"\n  }, \"Reliability:\"), \" Can I depend on it to do what I want?\"), mdx(\"li\", {\n    parentName: \"ul\"\n  }, mdx(\"strong\", {\n    parentName: \"li\"\n  }, \"Ease of use:\"), \" How much effort does it require?\"), mdx(\"li\", {\n    parentName: \"ul\"\n  }, mdx(\"strong\", {\n    parentName: \"li\"\n  }, \"Flexibility:\"), \" How many things does it do?\"), mdx(\"li\", {\n    parentName: \"ul\"\n  }, mdx(\"strong\", {\n    parentName: \"li\"\n  }, \"Status:\"), \" How does it affect the way others perceive me?\"), mdx(\"li\", {\n    parentName: \"ul\"\n  }, mdx(\"strong\", {\n    parentName: \"li\"\n  }, \"Aesthetics:\"), \" How attractive or aesthetically pleasing is it?\"), mdx(\"li\", {\n    parentName: \"ul\"\n  }, mdx(\"strong\", {\n    parentName: \"li\"\n  }, \"Emotion:\"), \" How does it make me feel?\"), mdx(\"li\", {\n    parentName: \"ul\"\n  }, mdx(\"strong\", {\n    parentName: \"li\"\n  }, \"Cost:\"), \" How much do I have to give to get this?\")), mdx(\"p\", null, \"Products can be roughly split into two categories:\"), mdx(\"ul\", null, mdx(\"li\", {\n    parentName: \"ul\"\n  }, mdx(\"strong\", {\n    parentName: \"li\"\n  }, \"Convenient:\"), \" Things that are quick, reliable, easy and flexible.\"), mdx(\"li\", {\n    parentName: \"ul\"\n  }, mdx(\"strong\", {\n    parentName: \"li\"\n  }, \"High-fidelity:\"), \" Things that offer quality, status, aesthetic appeal or emotional impact.\")), mdx(\"p\", null, \"It\\u2019s incredibly difficult to optimize both convenience and fidelity at the same time. You should try to provide the most of one amongst competing offers.\"), mdx(\"h4\", null, \"Relative Importance Testing\"), mdx(\"blockquote\", null, mdx(\"p\", {\n    parentName: \"blockquote\"\n  }, \"As a rule, people never accept trade-offs unless they\\u2019re forced to make a decision. If the perfect option existed, they\\u2019d buy it.\")), mdx(\"p\", null, \"The best way to discover what people value is to ask them to make explicit trade-offs during research. This can be accomplished using a research methodology known as \", mdx(\"em\", {\n    parentName: \"p\"\n  }, \"relative importance testing\"), \".\"), mdx(\"h4\", null, \"Critical Assumptions\"), mdx(\"blockquote\", null, mdx(\"p\", {\n    parentName: \"blockquote\"\n  }, \"Critical assumptions are facts or characteristics that must be true in the real world for your business or offering to be successful. Every new business or offer has a set of critical assumptions, and if any critical assumptions turn out to be false, the business idea will be vastly less promising than it appears.\")), mdx(\"blockquote\", null, mdx(\"p\", {\n    parentName: \"blockquote\"\n  }, \"The more accurately you can identify these \", \"[critical assumptions]\", \" in advance and actually test whether or not they\\u2019re true, the less risk you\\u2019ll be taking and the more confidence you\\u2019ll have in the wisdom of your decisions.\")), mdx(\"h4\", null, \"Shadow Testing\"), mdx(\"blockquote\", null, mdx(\"p\", {\n    parentName: \"blockquote\"\n  }, \"Shadow testing is the process of selling an offering before it actually exists. As long as you\\u2019re completely upfront with your potential customers that the offering is still in development, shadow testing is a very useful strategy you can use to actually test your critical assumptions with real customers quickly and inexpensively.\")), mdx(\"blockquote\", null, mdx(\"p\", {\n    parentName: \"blockquote\"\n  }, \"Shadow testing allows you to get a critical piece of customer feedback you can get in no other way: whether or not people will actually pay for what you\\u2019re developing.\")), mdx(\"h4\", null, \"Minimum Viable Offer\"), mdx(\"blockquote\", null, mdx(\"p\", {\n    parentName: \"blockquote\"\n  }, \"A minimum viable offer is an offer that promises and/or provides the smallest number of benefits necessary to produce an actual sale.\")), mdx(\"p\", null, \"It\\u2019s important to note that an MVO is only done when someone actually buys it.\"), mdx(\"blockquote\", null, mdx(\"p\", {\n    parentName: \"blockquote\"\n  }, \"Creating a minimum viable offer is useful because it\\u2019s impossible to predict 100% accurately what will work in advance. You don\\u2019t want to invest a ton of time and money into something that doesn\\u2019t have any chance of working, and the faster you can figure out if your idea will work or not, the better off you\\u2019ll be.\")), mdx(\"h4\", null, \"Incremental Augmentation\"), mdx(\"blockquote\", null, mdx(\"p\", {\n    parentName: \"blockquote\"\n  }, \"Pick three attributes or features, get these very, very right and then forget about everything else\\u2026 By focusing on only a few core features in the first version, you are forced to find the true essence and value of the product.\")));\n}\n;\nMDXContent.isMDXComponent = true;"},"note":{"authors":["Josh Kaufman"],"category":"Business","date":"2018-04-18","published":true,"slug":"personal-mba","source":"The Personal MBA","title":"The Personal MBA","url":"https://smile.amazon.com/Personal-MBA-Master-Art-Business/dp/1591845572?sa-no-redirect=1"}},"pageContext":{"id":"9f7aa7b1-3437-563d-8120-bef536048e49","slug":"personal-mba","__params":{"slug":"personal-mba"}}},
    "staticQueryHashes": []}