{
    "componentChunkName": "component---src-pages-notes-note-slug-jsx",
    "path": "/notes/ideal-bootstrapped-business/",
    "result": {"data":{"mdx":{"body":"var _excluded = [\"components\"];\n\nfunction _extends() { _extends = Object.assign || function (target) { for (var i = 1; i < arguments.length; i++) { var source = arguments[i]; for (var key in source) { if (Object.prototype.hasOwnProperty.call(source, key)) { target[key] = source[key]; } } } return target; }; return _extends.apply(this, arguments); }\n\nfunction _objectWithoutProperties(source, excluded) { if (source == null) return {}; var target = _objectWithoutPropertiesLoose(source, excluded); var key, i; if (Object.getOwnPropertySymbols) { var sourceSymbolKeys = Object.getOwnPropertySymbols(source); for (i = 0; i < sourceSymbolKeys.length; i++) { key = sourceSymbolKeys[i]; if (excluded.indexOf(key) >= 0) continue; if (!Object.prototype.propertyIsEnumerable.call(source, key)) continue; target[key] = source[key]; } } return target; }\n\nfunction _objectWithoutPropertiesLoose(source, excluded) { if (source == null) return {}; var target = {}; var sourceKeys = Object.keys(source); var key, i; for (i = 0; i < sourceKeys.length; i++) { key = sourceKeys[i]; if (excluded.indexOf(key) >= 0) continue; target[key] = source[key]; } return target; }\n\n/* @jsxRuntime classic */\n\n/* @jsx mdx */\nvar _frontmatter = {\n  \"title\": \"Designing the Ideal Bootstrapped Business\",\n  \"Authors\": \"Jason Cohen\",\n  \"Published\": true,\n  \"Media\": {\n    \"id\": \"839ac8b9-f780-4e24-98d6-314d0ca385d5\",\n    \"name\": \"Video\",\n    \"color\": \"default\"\n  },\n  \"Slug\": \"ideal-bootstrapped-business\",\n  \"Source\": \"Microconf\",\n  \"Date\": {\n    \"start\": \"2020-08-31T00:00:00.000Z\",\n    \"end\": null,\n    \"time_zone\": null\n  },\n  \"Category\": {\n    \"id\": \"f60b7960-389a-42f6-995a-2575d34f2e2a\",\n    \"name\": \"Business\",\n    \"color\": \"default\"\n  },\n  \"Type\": {\n    \"type\": \"string\",\n    \"string\": \"Note\"\n  },\n  \"URL\": \"https://www.youtube.com/watch?v=otbnC2zE2rw\"\n};\nvar layoutProps = {\n  _frontmatter: _frontmatter\n};\nvar MDXLayout = \"wrapper\";\nreturn function MDXContent(_ref) {\n  var components = _ref.components,\n      props = _objectWithoutProperties(_ref, _excluded);\n\n  return mdx(MDXLayout, _extends({}, layoutProps, props, {\n    components: components,\n    mdxType: \"MDXLayout\"\n  }), mdx(\"p\", null, \"There are a couple of major reasons why SaaS businesses fail.\"), mdx(\"ul\", null, mdx(\"li\", {\n    parentName: \"ul\"\n  }, \"Entrepreneurs don\\u2019t build something people want.\"), mdx(\"li\", {\n    parentName: \"ul\"\n  }, \"Entrepreneurs don\\u2019t design something that fits into the structure of a bootstrapped business\\u2014e.g. it doesn\\u2019t account for the weaknesses or strengths of bootstrapping.\")), mdx(\"p\", null, \"To quit your job, you need to build a \", mdx(\"em\", {\n    parentName: \"p\"\n  }, \"cash machine\"), \": a business capable of generating $10,000 in revenue per month without you having to do \", mdx(\"em\", {\n    parentName: \"p\"\n  }, \"anything\"), \". This is the opposite of \", mdx(\"em\", {\n    parentName: \"p\"\n  }, \"one-offs\"), \", which only sell a product once, and never get easier.\"), mdx(\"h3\", null, \"Model\"), mdx(\"p\", null, \"You\\u2019re trying to build a \", mdx(\"em\", {\n    parentName: \"p\"\n  }, \"boutique\"), \"\\u2014a business that\\u2019s just you and expensive, but people buy into it because the service is amazing and the products are unique. You can be a boutique in anything.\"), mdx(\"ul\", null, mdx(\"li\", {\n    parentName: \"ul\"\n  }, \"Aim for 150 customers: 50 from scratching and clawing, 25 from guest posts and social media, and 75 from basic marketing.\"), mdx(\"li\", {\n    parentName: \"ul\"\n  }, \"To get to $10,000 / month, you need to be able to charge $67 / month for each of these customers. To hit this, target pricing tiers of $49, $99 and $249.\")), mdx(\"h3\", null, \"Marketing Budget\"), mdx(\"p\", null, mdx(\"em\", {\n    parentName: \"p\"\n  }, \"Use annual prepaid plans!\"), \" You\\u2019re offering a discount, but you\\u2019re gaining a marketing budget that you can spend to acquire new customers.\"), mdx(\"p\", null, \"At WP Engine, 25% of their customers elect to take the annual prepaid plan. This effectively gives them an infinite marketing budget, because their one-month cash output is less than their one-month cash input.\"), mdx(\"p\", null, \"The most important metric to track as a \", mdx(\"em\", {\n    parentName: \"p\"\n  }, \"small\"), \" business is \", mdx(\"em\", {\n    parentName: \"p\"\n  }, \"annual revenue per customer\"), \" (ARPC). \", mdx(\"strong\", {\n    parentName: \"p\"\n  }, \"Just raise your prices.\")), mdx(\"p\", null, \"Don\\u2019t build a business that \", mdx(\"em\", {\n    parentName: \"p\"\n  }, \"picks up pennies\"), \" (taking small percents off the top of something). It\\u2019s really hard to make money with this approach.\"), mdx(\"h3\", null, \"Choosing a Market\"), mdx(\"h4\", null, \"Bad Markets\"), mdx(\"p\", null, \"Don\\u2019t pick something where the pain the customer experiences is \", mdx(\"em\", {\n    parentName: \"p\"\n  }, \"temporary\"), \". You don\\u2019t want to have to catch them at a certain point in their life. For example, don\\u2019t target weddings, events, code profilers, etc.\"), mdx(\"p\", null, \"Don\\u2019t pick something that depends on vitality. It\\u2019s really hard to get going, and it\\u2019s often difficult and expensive to start.\"), mdx(\"p\", null, \"Don\\u2019t create a marketplace (buyers and sellers).\"), mdx(\"h4\", null, \"Good Markets\"), mdx(\"p\", null, \"You want to create somewhere where the value is \", mdx(\"em\", {\n    parentName: \"p\"\n  }, \"reoccurring\"), \". An example is something where the pain changes over time. This makes your tool a natural fit to keep up with the changes.\"), mdx(\"p\", null, \"Another important attribute of a good market is that it\\u2019s not real-time in its nature. This means it\\u2019s not important the user gets something from you \", mdx(\"em\", {\n    parentName: \"p\"\n  }, \"this instant\"), \" or it\\u2019s over. This can be things like decision-support (analytical, metrics, reports, monitoring), finance, project management or content. Hosting is a counterexample.\"), mdx(\"p\", null, \"Aftermarkets (tacking on to an existing market) can be really powerful. The customer bases are already established for you.\"), mdx(\"p\", null, \"Target a \", mdx(\"em\", {\n    parentName: \"p\"\n  }, \"big\"), \" market. Niches abound in big markets. It\\u2019s already a validated space, and it\\u2019s easy to locate your customers.\"));\n}\n;\nMDXContent.isMDXComponent = true;"},"note":{"authors":["Jason Cohen"],"category":"Business","media":"Video","date":"2020-08-31","published":true,"slug":"ideal-bootstrapped-business","source":"Microconf","title":"Designing the Ideal Bootstrapped Business","url":"https://www.youtube.com/watch?v=otbnC2zE2rw"}},"pageContext":{"id":"2ea5b539-6da5-548c-adf1-b78100d5c880","slug":"ideal-bootstrapped-business","__params":{"slug":"ideal-bootstrapped-business"}}},
    "staticQueryHashes": []}