{
    "componentChunkName": "component---src-pages-notes-note-slug-jsx",
    "path": "/notes/community-developer-marketing/",
    "result": {"data":{"mdx":{"body":"var _excluded = [\"components\"];\n\nfunction _extends() { _extends = Object.assign || function (target) { for (var i = 1; i < arguments.length; i++) { var source = arguments[i]; for (var key in source) { if (Object.prototype.hasOwnProperty.call(source, key)) { target[key] = source[key]; } } } return target; }; return _extends.apply(this, arguments); }\n\nfunction _objectWithoutProperties(source, excluded) { if (source == null) return {}; var target = _objectWithoutPropertiesLoose(source, excluded); var key, i; if (Object.getOwnPropertySymbols) { var sourceSymbolKeys = Object.getOwnPropertySymbols(source); for (i = 0; i < sourceSymbolKeys.length; i++) { key = sourceSymbolKeys[i]; if (excluded.indexOf(key) >= 0) continue; if (!Object.prototype.propertyIsEnumerable.call(source, key)) continue; target[key] = source[key]; } } return target; }\n\nfunction _objectWithoutPropertiesLoose(source, excluded) { if (source == null) return {}; var target = {}; var sourceKeys = Object.keys(source); var key, i; for (i = 0; i < sourceKeys.length; i++) { key = sourceKeys[i]; if (excluded.indexOf(key) >= 0) continue; target[key] = source[key]; } return target; }\n\n/* @jsxRuntime classic */\n\n/* @jsx mdx */\nvar _frontmatter = {\n  \"title\": \"A Community-Driven Approach to Developer Marketing\",\n  \"Authors\": \"Rajoshi Ghosh\",\n  \"Published\": true,\n  \"Media\": {\n    \"id\": \"}L@k\",\n    \"name\": \"Live Talk\",\n    \"color\": \"default\"\n  },\n  \"Slug\": \"community-developer-marketing\",\n  \"Source\": \"DeveloperWeek 2019\",\n  \"Date\": {\n    \"start\": \"2019-02-21T00:00:00.000Z\",\n    \"end\": null,\n    \"time_zone\": null\n  },\n  \"Category\": {\n    \"id\": \"f60b7960-389a-42f6-995a-2575d34f2e2a\",\n    \"name\": \"Business\",\n    \"color\": \"default\"\n  },\n  \"Type\": {\n    \"type\": \"string\",\n    \"string\": \"Note\"\n  },\n  \"URL\": \"https://www.developerweek.com\"\n};\nvar layoutProps = {\n  _frontmatter: _frontmatter\n};\nvar MDXLayout = \"wrapper\";\nreturn function MDXContent(_ref) {\n  var components = _ref.components,\n      props = _objectWithoutProperties(_ref, _excluded);\n\n  return mdx(MDXLayout, _extends({}, layoutProps, props, {\n    components: components,\n    mdxType: \"MDXLayout\"\n  }), mdx(\"p\", null, \"The goal is to make each user an advocate. The rule of thumb is you give more to the community than you ask.\"), mdx(\"h3\", null, \"Product\"), mdx(\"p\", null, \"User experience is at the core of building your product. You want to make the user feel special. You want them to say, \\\"This was built for me.\\\"\"), mdx(\"p\", null, mdx(\"em\", {\n    parentName: \"p\"\n  }, \"Optimize for the aha moment.\")), mdx(\"h3\", null, \"Content\"), mdx(\"p\", null, \"Focus on media-rich content. Video is great. Developers are unique in consuming a much higher amount of content than other markets.\"), mdx(\"p\", null, \"You need to figure out your balance between educational content and product-focused content. Content that only focused on the product doesn't really work. But if you focus on education, people will come back to you.\"), mdx(\"p\", null, mdx(\"strong\", {\n    parentName: \"p\"\n  }, \"Content distribution is more important than content creation.\")), mdx(\"p\", null, \"When you're considering content distribution, where does the primary content live? You can redistribute content in other places.\"), mdx(\"p\", null, \"Only create content that will help your very small subset of customers. Eventually, you focus on partnership content.\"), mdx(\"p\", null, \"Once your content has been written, it can be reworked into other mediums. This helps you get much more bang for your buck.\"), mdx(\"pre\", null, mdx(\"code\", {\n    parentName: \"pre\",\n    \"className\": \"language-plain\",\n    \"metastring\": \"text\",\n    \"text\": true\n  }, \"* Videos\\n* Blog posts\\n* Courses\\n* Echo js\\n* Newslettters\\n* Sample apps\\n\")), mdx(\"p\", null, \"Another key insight is to localize content into other languages. This makes your product much more accessible. They used an online course as the initial viral marketing kick off.\"), mdx(\"p\", null, \"Once you find the long-lasting resources, you repeat this process.\"), mdx(\"h3\", null, \"Engineering as Marketing\"), mdx(\"p\", null, \"Create small free tools that complement the core product and help your users. These should relate to your area (\", mdx(\"em\", {\n    parentName: \"p\"\n  }, \"engineering as marketing\"), \"). They need to be use-case centric.\"), mdx(\"p\", null, \"Think of the core content and tools as part of your product, and then think of everything you would do to market that. All of this creates multiple opportunities to \\\"launch\\\".\"), mdx(\"h3\", null, \"Support\"), mdx(\"p\", null, mdx(\"em\", {\n    parentName: \"p\"\n  }, \"Product engineers should be on support.\"), \" This can be one of your biggest differentiators. Larger companies typically have terrible support.\"), mdx(\"p\", null, \"You need to have frequent product releases and quick response times. Keep track of feature requests and then let people know when you implement them. This makes people feel special and like their voice has been heard.\"), mdx(\"h3\", null, \"Users\"), mdx(\"p\", null, mdx(\"strong\", {\n    parentName: \"p\"\n  }, \"Acknowledge and appreciate your users.\"), \" People don't expect that and they feel good when they're acknowledged.\"), mdx(\"p\", null, \"One thing they did was take the people who were most helpful in their community and made \\\"community champion\\\" t-shirts for them. This small act actually made people more responsive.\"), mdx(\"p\", null, mdx(\"strong\", {\n    parentName: \"p\"\n  }, \"Support is huge in the early stages.\")), mdx(\"h3\", null, \"Strategy\"), mdx(\"p\", null, \"You always want a team that's running a lot of experiments. You want to identify things that will eventually become dedicated teams. When you start, your goal is to write playbooks. Eventually, those can be spun off to individuals and eventually teams.\"), mdx(\"p\", null, \"You have to do experiments long enough. They advocate for at least 3 months. If you don't give it enough time, you can't expect it to work.\"), mdx(\"ol\", null, mdx(\"li\", {\n    parentName: \"ol\"\n  }, \"Do a mini launch\"), mdx(\"li\", {\n    parentName: \"ol\"\n  }, \"Figure out the things that you do that are working.\"), mdx(\"li\", {\n    parentName: \"ol\"\n  }, \"Slice and dice each piece, think about them as separate products, create lots of resources around it.\")), mdx(\"p\", null, \"You don't want to create too much content. \", mdx(\"strong\", {\n    parentName: \"p\"\n  }, \"Focus on maximum distribution of your content, amazing support and the developer experience.\")));\n}\n;\nMDXContent.isMDXComponent = true;"},"note":{"authors":["Rajoshi Ghosh"],"category":"Business","media":"Live Talk","date":"2019-02-21","published":true,"slug":"community-developer-marketing","source":"DeveloperWeek 2019","title":"A Community-Driven Approach to Developer Marketing","url":"https://www.developerweek.com"}},"pageContext":{"id":"a70331f7-0ab4-5eab-896d-c48b2ec183db","slug":"community-developer-marketing","__params":{"slug":"community-developer-marketing"}}},
    "staticQueryHashes": []}